person_id,person_name,project_id_number,institution_id,institution_name
1413351,Professor Dr. Wolfgang Menzel,968025,10192,Universität Hamburg
14270006,Professorin Dr. Christine Büchner,242138915,10192,Universität Hamburg
949773,Professorin Dr. Birgit Richter,163806979,10192,Universität Hamburg
1323849,Professor Dr. Wolfram Weiße,5184930,10192,Universität Hamburg
187372876,Dr. Stefan Thiemann,203077103,10192,Universität Hamburg
13491465,Dr. Kirsten von Bergmann,16523130,10192,Universität Hamburg
12590298,Privatdozent Dr. Tobias Kipp,5273734,10192,Universität Hamburg
1748283,Privatdozent Dr. Alexander Chudnovskiy,5410175,10192,Universität Hamburg
1289347,Professor Dr. Hans Steinhart,272553,10192,Universität Hamburg
1345597,Professor Dr. Stefan Heidemann,5322392,10192,Universität Hamburg
1086342,Professor Dr. Christopher Habel,968025,10192,Universität Hamburg
1673338,Professor Dr. Peter Siemund,5413478,10192,Universität Hamburg
221568168,Professorin Dr. Ulrike Frühling,201255846,10192,Universität Hamburg
6490,Professor Dr. Jürgen Sündermann,5094284,10192,Universität Hamburg
987969,Professor Dr. Werner Alpers,5094334,10192,Universität Hamburg
1420401,Dr. Tobias Vossmeyer,221132716,10192,Universität Hamburg
1346180,Professor Dr. Wolfgang Hansen,271055,10192,Universität Hamburg
1550661,Professor Dr. Jianwei Zhang,968025,10192,Universität Hamburg
1793812,Professorin Dr. Claudia Schindler,242138915,10192,Universität Hamburg
1016063,Professor Dr. José A. C. Broekaert,273033,10192,Universität Hamburg
817941,Professorin Dr. Barbara Schenk,273523,10192,Universität Hamburg
1456269,Professor Dr. Michael Potthoff,5345044,10192,Universität Hamburg
1199791,Dr. Renate Nestvogel,273249,10192,Universität Hamburg
29529136,Professor Dr. Ulf Kühn,273591,10192,Universität Hamburg
201280620,Dr. Christoph Becker,201280368,10192,Universität Hamburg
1015777,Professor Dr. Reinhard Bredehorst,272553,10192,Universität Hamburg
261222,Professor Dr. Arno Combe,273523,10192,Universität Hamburg
1122890,Professor Dr. Norbert Jürgens,5356970,10192,Universität Hamburg
29569819,Dr. Stefanie Brinkmann,312721107,10192,Universität Hamburg
1126962,Professorin Dr. Gabriele Kaiser,273523,10192,Universität Hamburg
226297408,Dr. Alexa Griesel,318909056,10192,Universität Hamburg
1581926,Professor Dr. Christian Brockmann,203048708,10192,Universität Hamburg
1707274,Dr. Ingo Harms,5286680,10192,Universität Hamburg
1578921,Professor Dr. Ingenuin Gasser,272361,10192,Universität Hamburg
136989898,Dr. Uwe Wolter,19902941,10192,Universität Hamburg
1584347,Professor Dr. Michael Fröba,273033,10192,Universität Hamburg
9543848,Professor Dr.-Ing. Karl Kaiser,66618758,10192,Universität Hamburg
70386702,Professor Dr. Frank Lechermann,70367156,10192,Universität Hamburg
143381658,Professor Dr. Gerd Mühlheußer,112250352,10192,Universität Hamburg
1521697,Professor Dr. Sighard Neckel,273619,10192,Universität Hamburg
230747694,Professor Dr. Ludwig Mathey,230747390,10192,Universität Hamburg
1854307,Professor Dr. Dieter Horns,28955252,10192,Universität Hamburg
1612348,Professorin Dr. Gabriele Oettingen,273523,10192,Universität Hamburg
1674458,Professor Dr. Robert Klanner,28955159,10192,Universität Hamburg
1228871,Professor Dr. Jochen Rehbein,5179710,10192,Universität Hamburg
79788022,Professorin Dr. Barbara Hänel-Faulhaber,5456564,10192,Universität Hamburg
171511226,Dr. Rutger Boels,171510994,10192,Universität Hamburg
1369844,Professor Dr. Hartmut Schlüter,247354600,10192,Universität Hamburg
1494121,Dr. Christian Heyn,5273826,10192,Universität Hamburg
1673308,Professor Dr. Bernd Meyer,272553,10192,Universität Hamburg
88511783,Dr. Jörn Kersten,68155001,10192,Universität Hamburg
1707267,Privatdozent Dr. Richard Blender,5094266,10192,Universität Hamburg
1389205,Professor Dr. Volkmar Vill,272553,10192,Universität Hamburg
54822751,Professor Dr. Philippe Depreux,279243356,10192,Universität Hamburg
210237054,Professor Dr. Christian Biemann,240177810,10192,Universität Hamburg
151410057,Dr. Stefan Krause,18387219,10192,Universität Hamburg
28895219,Professorin Dr. Caren Hagner,28895201,10192,Universität Hamburg
1209971,Professor Dr. Hans Paulsen,5359787,10192,Universität Hamburg
1142625,Professor Dr. Rainer Kokemohr,5184908,10192,Universität Hamburg
1748703,Professorin Dr. Julia Pauli,5354492,10192,Universität Hamburg
1707290,Dr. Angelo Rubino,5094334,10192,Universität Hamburg
1168378,"Professorin Dr. Conxita Lleó, Ph.D.",5179792,10192,Universität Hamburg
1354376,Professorin Dr. Daniela Pfannkuche,271055,10192,Universität Hamburg
1673885,Professorin Dr. Julia Kehr,5354827,10192,Universität Hamburg
1015088,Professor Dr. Kurt Braunmüller,5179852,10192,Universität Hamburg
1184917,Professor Dr. Ulrich Merkt,271055,10192,Universität Hamburg
1367022,Professor Dr. Roland Wiesendanger,271055,10192,Universität Hamburg
1796312,Privatdozent Dr. Thomas Frisius,5431034,10192,Universität Hamburg
1201035,Professorin Dr. Ursula Neumann,5184888,10192,Universität Hamburg
1037190,Professorin Dr. Leonie S. Dreschler-Fischer,203079013,10192,Universität Hamburg
1641140,Dr. Carsten Paulmann,273033,10192,Universität Hamburg
1439631,Professor Dr. Stefan Wermter,968025,10192,Universität Hamburg
48554016,Professor Dr. Hermann Held,38787541,10192,Universität Hamburg
1607893,Professor Dr. Volker Abetz,5121638,10192,Universität Hamburg
1003772,Professor Dr. Ulrich Bismayer,273033,10192,Universität Hamburg
1389911,Professor Dr. Meinert A. Meyer,273523,10192,Universität Hamburg
1762000,Professor Dr. Gleb Arutyunov,163806979,10192,Universität Hamburg
1534548,Professor Dr. Klaus Sengstock,5362442,10192,Universität Hamburg
15704983,Professor Dr. Frank Adloff,178036356,10192,Universität Hamburg
261220,Professor Dr. Johannes Bastian,273523,10192,Universität Hamburg
1801886,Professor Dr. Roman Schnabel,5409365,10192,Universität Hamburg
171353309,Professorin Dr. Gudrid Moortgat-Pick,28895157,10192,Universität Hamburg
202176775,Professor Dr. Henning Lohmann,202176649,10192,Universität Hamburg
1259052,Dr. Manfred Schmidt,5362247,10192,Universität Hamburg
112496775,Professor Dr. Patrick C. Leyens,112250352,10192,Universität Hamburg
1350634,Professor Dr. Hans-Christoph Koller,273523,10192,Universität Hamburg
62174342,Professor Dr. Frank Steinicke,289664756,10192,Universität Hamburg
233886256,Dr. Jens Oldeland,233885761,10192,Universität Hamburg
1661894,Dr. Alexander Schwarz,18325502,10192,Universität Hamburg
1127431,Professor Dr.-Ing. Franz Xaver Kärtner,194651731,10192,Universität Hamburg
184462243,Dr. Falk Daviter,184453748,10192,Universität Hamburg
1478658,Professor Dr. Markus Drescher,18387272,10192,Universität Hamburg
1186162,Professor Dr. Chris Meier,272553,10192,Universität Hamburg
1208629,Professor Dr. Jürgen Oßenbrügge,5184902,10192,Universität Hamburg
328196936,Dr. Jacopo Torregrossa,328195521,10192,Universität Hamburg
1077737,Professor Dr. Heinrich Graener,270059,10192,Universität Hamburg
1592363,Dr. Ute Luksch,5094254,10192,Universität Hamburg
1006859,Professor Dr. Bodo von Borries,273523,10192,Universität Hamburg
1592949,Professor Dr. Michael Hinze,5103871,10192,Universität Hamburg
1761820,Professor Dr. Stefan Oeter,112250352,10192,Universität Hamburg
259392745,Professorin Dr. Franziska Weber,112250352,10192,Universität Hamburg
20087504,Dr. Andreas Schweitzer,19902941,10192,Universität Hamburg
1200344,Professorin Dr. Irene Neverla,38787541,10192,Universität Hamburg
1419555,Professor Dr. Robert L. Johnson,271055,10192,Universität Hamburg
1852708,Privatdozent Dr. Wolfram Schmidt,211202398,10192,Universität Hamburg
279231921,Professorin Dr. Hanna Wimmer,279231724,10192,Universität Hamburg
1229549,Professorin Dr. Mechthild Reh,5179746,10192,Universität Hamburg
1092748,Professor Dr. Ernst Heinz,272553,10192,Universität Hamburg
1577234,Professorin Dr. Juliane House,5179740,10192,Universität Hamburg
1655964,Professor Dr. Christian Lohr,273567,10192,Universität Hamburg
1721896,Professor Dr. Jörn Peckmann,273315,10192,Universität Hamburg
1816968,Privatdozentin Dr. Elena Vedmedenko,18386988,10192,Universität Hamburg
266396807,Dr. Christof Weitenberg,277192933,10192,Universität Hamburg
990976,Professor Dr. Jochen Bartels,273011,10192,Universität Hamburg
12590360,Dr. Jens Wiebe,5386783,10192,Universität Hamburg
1087189,Professor Dr. Ulrich Hahn,272115,10192,Universität Hamburg
1455992,Professor Dr. Martin Kalinowski,38787541,10192,Universität Hamburg
1181759,Professor Dr. Jürgen Michael Meisel,5179776,10192,Universität Hamburg
1124338,Professor Dr. Rolf H. Käse,5359162,10192,Universität Hamburg
262430,Professorin Dr. Brigitte Röder,968025,10192,Universität Hamburg
33851600,Professor Dr. Sven-Olaf Moch,5396822,10192,Universität Hamburg
991068,Professor Dr. Jan Backhaus,272361,10192,Universität Hamburg
154608119,Dr. Markus Bolte,12387132,10192,Universität Hamburg
248460640,Professor Dr. Nils Huse,201267818,10192,Universität Hamburg
1824785,Professor Dr. Peter Schleper,28895182,10192,Universität Hamburg
193995032,Professor Dr. Henning Moritz,201294759,10192,Universität Hamburg
1016158,Professor Dr. Burghard Brümmer,5094302,10192,Universität Hamburg
1527533,Privatdozent Dr. Thomas Pohlmann,5094284,10192,Universität Hamburg
1592396,Professorin Dr. Katharina Heinke Schlünzen,272361,10192,Universität Hamburg
1114548,Professor Dr. Günter Huber,272543,10192,Universität Hamburg
1803245,Dr. Sabine Pütter,18387070,10192,Universität Hamburg
26888065,Privatdozent Dr. Dirk Warnecke,5359783,10192,Universität Hamburg
1425336,Professor Dr. Jens Struckmeier,272361,10192,Universität Hamburg
18386824,Dr. André Kubetzka,18386723,10192,Universität Hamburg
1084923,Professor Dr. Walther von Hahn,5179734,10192,Universität Hamburg
1531044,Professor Dr. Norbert Ritter,5083746,10192,Universität Hamburg
1343377,Professor Dr. Carl-Wilhelm Vogel,5359751,10192,Universität Hamburg
229803386,Professor Dr.-Ing. Jens Falkenstein,229803235,10345,Universität Rostock
1848959,Dr. Günter Manzke,5454288,10345,Universität Rostock
1110390,Professor Dr. Klaus Hock,967893,10345,Universität Rostock
240444471,Professor Dr. Boris Hage,240444283,10345,Universität Rostock
1809680,Professor Dr. Sergey Verevkin,823996,10345,Universität Rostock
1821797,Professor Dr.-Ing. Helmut Beikirch,269237,10345,Universität Rostock
374482333,Professor Dr.-Ing. Bert Buchholz,374482293,10345,Universität Rostock
1403302,Professor Dr.-Ing. Wolfgang Fredrich,269237,10345,Universität Rostock
1343022,Privatdozent Dr. Reinhard Mahnke,272909,10345,Universität Rostock
1349156,Professor Dr. Arndt Rolfs,269007,10345,Universität Rostock
1231079,Professor Dr. Ronald Redmer,272909,10345,Universität Rostock
254292,Professor Dr. Paul Jeroschewski,269237,10345,Universität Rostock
1658103,Professor Dr. Clemens Cap,272563,10345,Universität Rostock
1844699,Professor Dr. Rafael Weißbach,374400,10345,Universität Rostock
211618198,Professor Dr.-Ing. Patrick Kaeding,211611369,10345,Universität Rostock
1512964,Professorin Dr. Gabriele Linke,967893,10345,Universität Rostock
1456527,Professor Dr. Jakob Rösel,967893,10345,Universität Rostock
1088201,Professor Dr. Heiner Hastedt,216734353,10345,Universität Rostock
1826552,Professorin Dr. Anja Ursula Bräuer,5150101,10345,Universität Rostock
50684414,Professor Dr.-Ing. Hermann Seitz,50684363,10345,Universität Rostock
1410275,Professorin Dr. Ursula van Rienen,269237,10345,Universität Rostock
1184354,Professor Dr. Karl-Heinz Meiwes-Broer,272909,10345,Universität Rostock
1243522,Professor Dr. Joachim Rychly,269007,10345,Universität Rostock
999118,Privatdozent Dr. Michael Beyer,272909,10345,Universität Rostock
1707398,Professor Dr.-Ing. Harald Aschemann,92915098,10345,Universität Rostock
1169802,Privatdozent Dr. Marian Löbler,5355102,10345,Universität Rostock
407506727,Dr.-Ing. Volker Wichmann,254111932,10345,Universität Rostock
1033004,Professor Dr.-Ing. Ulrich Diederichs,196440394,10345,Universität Rostock
230560858,Dr.-Ing. Benjamin Milkereit,230561678,10345,Universität Rostock
1021022,Professor Dr. Eberhard Burkel,272909,10345,Universität Rostock
1110661,Professor Dr. Heinrich Holze,967893,10345,Universität Rostock
1554077,Professor Dr. Franz-Josef Holznagel,967893,10345,Universität Rostock
1609819,Professor Dr. Dietmar Schiffmann,269237,10345,Universität Rostock
1588071,Professor Dr.-Ing. Klaus-Peter Schmitz,272909,10345,Universität Rostock
1431266,Professor Dr. Robert Jaster,269007,10345,Universität Rostock
1752290,Dr. August Wierling,5358592,10345,Universität Rostock
1735593,Dr. Sabine Böckmann,269007,10345,Universität Rostock
1861646,Professorin Dr. Judith Gärtner,216734353,10345,Universität Rostock
237042782,Professor Dr. Sven Bruhn,315691478,10345,Universität Rostock
1151271,Professor Dr. Dietrich Kremp,5330874,10345,Universität Rostock
194899767,Privatdozent Dr. Hugo Murua Escobar,46014532,10345,Universität Rostock
1353467,Professorin Dr. Inge Paegelow,269007,10345,Universität Rostock
1865166,Professor Dr. Hans-Uwe Lammel,967893,10345,Universität Rostock
1321652,Professor Dr. Nikolaus Werz,967893,10345,Universität Rostock
1462505,Professor Dr. Oliver Kühn,273459,10345,Universität Rostock
842246,Professor Dr. Udo Kragl,823996,10345,Universität Rostock
1053759,Professor Dr. Hans-Joachim Fitting,272909,10345,Universität Rostock
1240064,Professor Dr. Gerd Röpke,272909,10345,Universität Rostock
1594516,Professor Dr. Johannes Thome,5421305,10345,Universität Rostock
1686660,Professor Dr.-Ing. Peter Forbrig,20190020,10345,Universität Rostock
262985388,"Professorin Dr. Inna M. Sokolova, Ph.D.",240942083,10345,Universität Rostock
1408891,Professor Dr.-Ing. Dirk Timmermann,272563,10345,Universität Rostock
204534300,Dr. Lydia Gustavs,114462072,10345,Universität Rostock
1797857,Professor Dr.-Ing. Ralf Salomon,20190020,10345,Universität Rostock
1426761,Professor Dr. Armin Börner,823996,10345,Universität Rostock
1362090,Professor Dr. Heinrich Stolz,272909,10345,Universität Rostock
1521934,Professorin Dr. Barbara Nebe,269007,10345,Universität Rostock
241928755,Professor Dr. Holger Kösters,16870573,10345,Universität Rostock
24880096,Privatdozent Dr. Stefan Forster,240942083,10345,Universität Rostock
257843,Professor Dr. Henning Schröder,272909,10345,Universität Rostock
27829835,Professor Dr. Lars Schwabe,20190020,10345,Universität Rostock
1302083,Professor Dr. Markus Tiedge,273293,10345,Universität Rostock
1457943,Professor Dr. Steffen Emmert,374717,10345,Universität Rostock
1271970,Professorin Dr.-Ing. Heidrun Schumann,272563,10345,Universität Rostock
93713484,Professor Dr.-Ing. Horst Harndorf,93713856,10345,Universität Rostock
257091,Professor Dr. Reinhard Schmidt,269007,10345,Universität Rostock
258477,Dr. Hermann Walzel,269007,10345,Universität Rostock
1069496,Professor Dr. Jan Gimsa,55641801,10345,Universität Rostock
260838,Privatdozent Dr. Roland Waldi,272909,10345,Universität Rostock
1870133,Professor Dr. Golo D. Kronenberg,63587779,10345,Universität Rostock
258493,Privatdozent Dr. Michael Steiner,269007,10345,Universität Rostock
1658761,Professor Dr. Stefan Scheel,240397179,10345,Universität Rostock
260834,Privatdozent Dr. Reinhard Bornath,272909,10345,Universität Rostock
26743294,Professor Dr.-Ing. Dennis Hohlfeld,384294636,10345,Universität Rostock
241578708,Privatdozent Dr. Marcus Frank,241578548,10345,Universität Rostock
1135602,Professor Dr. Ernst Klar,5158238,10345,Universität Rostock
91338112,Professor Dr.-Ing. Gerhard Scharr,91338096,10345,Universität Rostock
1100790,Professor Dr. Klaus Henneberger,272909,10345,Universität Rostock
1067649,Professor Dr. Thomas Gerber,269237,10345,Universität Rostock
1402214,Dr. Eilhard Mix,269007,10345,Universität Rostock
178056066,Professor Dr.-Ing. Hans-Günter Eckel,178055620,10345,Universität Rostock
1860870,Dr. Ingo Barke,240395637,10345,Universität Rostock
1201275,Professor Dr. Hans-Georg Neumann,272909,10345,Universität Rostock
1001110,Professor Dr.-Ing. Detlef Behrend,51626437,10345,Universität Rostock
1204834,Professor Dr. Thomas Noack,269007,10345,Universität Rostock
1099744,Professor Dr. Andreas Heuer,272563,10345,Universität Rostock
116674053,Privatdozent Dr.-Ing. Daniel Klüß,384294579,10345,Universität Rostock
1588490,Professor Dr. Bernd Joachim Krause,247685044,10345,Universität Rostock
122350269,Professorin Dr. Gesche Linde,216734353,10345,Universität Rostock
1319849,Professor Dr. Dieter G. Weiss,269237,10345,Universität Rostock
1411417,Privatdozent Dr. Thomas Bittorf,269007,10345,Universität Rostock
257089,Professor Dr. H. Schmidt,269007,10345,Universität Rostock
1573795,Professor Dr. Alexander Storch,22238962,10345,Universität Rostock
1289914,Professor Dr. Gustav Steinhoff,5083524,10345,Universität Rostock
1357565,Professor Dr.-Ing. Mathias Paschen,195930613,10345,Universität Rostock
967885,Professorin Dr. Gesa Mackenthun,967893,10345,Universität Rostock
993024,Professor Dr. Hermann Bauwe,5354979,10345,Universität Rostock
968595,Dr. Christoph Schmitt,967893,10345,Universität Rostock
843196,Professor Dr. Olaf Wolkenhauer,19986351,10345,Universität Rostock
1104853,Professor Dr.-Ing. Karl-Heinz Hirschmann,269237,10345,Universität Rostock
1664984,Professor Dr. Hubertus Gersdorf,272563,10345,Universität Rostock
1188342,Professor Dr. Fedor Mitschke,272909,10345,Universität Rostock
1312078,Professor Dr. Werner Vogel,272909,10345,Universität Rostock
968668,Professor Dr.-Ing. Thomas Kirste,20190020,10345,Universität Rostock
1480350,Professor Dr. Konrad Engel,55641801,10345,Universität Rostock
201119643,Dr. Manon Janssen,240942083,10345,Universität Rostock
1330401,Professor Dr. Martin Witt,227701426,10345,Universität Rostock
1500195,Professor Dr. Anselm Jünemann,5361770,10345,Universität Rostock
136724165,Professor Dr. Thomas Fennel,136724041,10345,Universität Rostock
175812352,Professorin Dr. Stephanie Wodianka,967893,10345,Universität Rostock
108993623,Professor Dr. Eckart Reinmuth,216734353,10345,Universität Rostock
1210655,Professor Dr. Hans-Wilhelm Pau,55641801,10345,Universität Rostock
1197505,Professorin Dr.-Ing. Erika Müller,272563,10345,Universität Rostock
259633,Professor Dr. Friedemann W. Nerdinger,272563,10345,Universität Rostock
6498,Professor Dr.-Ing. Djamshid Tavangarian,20190020,10345,Universität Rostock
1703861,Professor Dr. Yves Bizeul,216734353,10345,Universität Rostock
842253,Professor Dr. Norbert Stoll,823996,10345,Universität Rostock
1383603,Professor Dr. Wolf-Dietrich Kraeft,5330868,10345,Universität Rostock
1666901,Professor Dr. Matthias Peuster,5403535,10345,Universität Rostock
254129,Professor Dr. Lienhard Pagel,269237,10345,Universität Rostock
1631279,Dr. Martin Brede,240942083,10345,Universität Rostock
1830437,Professor Dr.-Ing. Dietmar Jackèl,272563,10345,Universität Rostock
1530539,Privatdozentin Dr. Heidi E.M. Reinholz,5454194,10345,Universität Rostock
1154940,Professor Dr. Erwin Kunesch,5330198,10345,Universität Rostock
56788371,Professor Dr.-Ing. Frank-Hendrik Wurm,206458664,10345,Universität Rostock
996733,Professor Dr. Reiner Benecke,269007,10345,Universität Rostock
1405356,Privatdozentin Dr. Rhena Schumann,114462072,10345,Universität Rostock
442455,Professor Dr. Oliver Staadt,20190020,10345,Universität Rostock
1442057,Professor Dr. Thomas Schmitt-John,5081590,379818,Aarhus University
255245,Professor Dr. Bernd Marx,270327,10361,Technische Universität Ilmenau
1275086,Professor Dr.-Ing. Gerd Scarbata,270327,10361,Technische Universität Ilmenau
1768075,Dr.-Ing. Alf Harnisch,5378693,10361,Technische Universität Ilmenau
1767983,Professor Dr.-Ing. René Theska,5378642,10361,Technische Universität Ilmenau
1060880,Privatdozent Dr.-Ing. Karl-Heinz Franke,5378765,10361,Technische Universität Ilmenau
255243,Professor Dr. Armin Hoffmann,270327,10361,Technische Universität Ilmenau
1587181,Professor Dr.-Ing. Thomas Sattel,5378605,10361,Technische Universität Ilmenau
1456421,Professor Dr. Siegfried Stapf,5187055,10361,Technische Universität Ilmenau
91385209,Professor Dr. Andreas Schober,231402137,10361,Technische Universität Ilmenau
1404494,Professor Dr.-Ing. Andreas Mitschele-Thiel,50111252,10361,Technische Universität Ilmenau
60700453,Dr. Wichard J.D. Beenken,255377421,10361,Technische Universität Ilmenau
1799710,Professor Dr. Gert Winkler,270327,10361,Technische Universität Ilmenau
1768154,Professor Dr.-Ing. Mathias Weiß,5378774,10361,Technische Universität Ilmenau
91173982,Professor Dr.-Ing. Thomas Fröhlich,89085041,10361,Technische Universität Ilmenau
1226203,Professor Dr.-Ing. Ivo W. Rangelow,137440734,10361,Technische Universität Ilmenau
1768194,Silke Augustin,5378795,10361,Technische Universität Ilmenau
1630320,Professor Dr. Andreas Bund,5367665,10361,Technische Universität Ilmenau
78292559,Professorin Dr. Gabriele Eichfelder,89085041,10361,Technische Universität Ilmenau
13738847,Professor Dr.-Ing. Roland Füßl,5378527,10361,Technische Universität Ilmenau
1767806,Professor Dr.-Ing. Eberhard Manske,5378527,10361,Technische Universität Ilmenau
1686050,Professor Dr. Thomas Hannappel,361886954,10361,Technische Universität Ilmenau
1768163,Professor Dr.-Ing. Peter Kurtz,5378777,10361,Technische Universität Ilmenau
1427295,Professorin Dr. Edda Rädlein,89085041,10361,Technische Universität Ilmenau
1350302,Professor Dr.-Ing. Horst-Michael Groß,270327,10361,Technische Universität Ilmenau
1399313,Professor Dr.-Ing. Christian Weber,5378642,10361,Technische Universität Ilmenau
1649766,Professor Dr. Rainer Grünwald,79664321,10361,Technische Universität Ilmenau
1216269,Professorin Dr.-Ing. Ilka Philippow,270327,10361,Technische Universität Ilmenau
1591025,Dr.-Ing. Ulrich Lüdtke,89085041,10361,Technische Universität Ilmenau
1414718,Professor Dr.-Ing. Klaus Zimmermann,5378635,10361,Technische Universität Ilmenau
1630967,Professor Dr.-Ing. Hannes Toepfer,244312856,10361,Technische Universität Ilmenau
1185215,Professorin Dr. Bettine Menke,373035,10768,Universität Erfurt
1604636,Professor Dr. Hartmut Rosa,5319176,10768,Universität Erfurt
1457118,Professor Dr. Wolfgang Struck,373035,10768,Universität Erfurt
1607861,Professor Dr. Patrick Rössler,194410754,10768,Universität Erfurt
20209735,Professor Dr. Winfried Brugger,20066823,10768,Universität Erfurt
1616404,Professor Dr. Frank Ettrich,20066823,10768,Universität Erfurt
1196995,Professor Dr. Martin Mulsow,5291280,10768,Universität Erfurt
1513973,Professor Dr. Alf Lüdtke,373035,10768,Universität Erfurt
252196,Professor Dr. Dietmar Mieth,273615,10768,Universität Erfurt
1712872,Professorin Dr. Sibylle Kalupner,20066823,10768,Universität Erfurt
14290677,Professor Dr. Cornel Zwierlein,63382699,10768,Universität Erfurt
113397729,Professor Dr. Bernhard Kleeberg,24060127,10768,Universität Erfurt
1711236,Dr. Thomas Kühne,5293476,10325,Technische Universität Kaiserslautern
40526062,Dr. Ilka Haferkamp,273567,10325,Technische Universität Kaiserslautern
1558516,Professor Dr.-Ing. Alois K. Schlarb,273515,10325,Technische Universität Kaiserslautern
22751047,Professor Dr. James R. Anglin,317078937,10325,Technische Universität Kaiserslautern
1390977,Professor Dr. Ralf Korn,273385,10325,Technische Universität Kaiserslautern
1060834,Professor Dr. Jürgen Franke,273385,10325,Technische Universität Kaiserslautern
1114709,Professor Dr. Wolfgang Hübner,5200070,10325,Technische Universität Kaiserslautern
1672951,Professor Dr. Bernd Simeon,272465,10325,Technische Universität Kaiserslautern
1033202,Professor Dr. Rolf Diller,5114184,10325,Technische Universität Kaiserslautern
1073040,Professor Dr.-Ing. Reinhard Gotzhein,5360080,10325,Technische Universität Kaiserslautern
175608000,Dr. Kerstin Münnemann,290452276,10325,Technische Universität Kaiserslautern
1029438,Professor Dr. Joachim W. Deitmer,273567,10325,Technische Universität Kaiserslautern
1508106,Professor Dr. Sven Oliver Krumke,273385,10325,Technische Universität Kaiserslautern
1233227,Professor Dr. Michael Richter,5083740,10325,Technische Universität Kaiserslautern
171009446,Dr. Thomas Markwig,324816657,10325,Technische Universität Kaiserslautern
317561236,Dr. Timo Mühlhaus,317559929,10325,Technische Universität Kaiserslautern
197049249,Dr.-Ing. Marek Smaga,197048648,10325,Technische Universität Kaiserslautern
197056747,Dr. Christine Müller-Renno,197049382,10325,Technische Universität Kaiserslautern
1369173,Professor Dr. Willi Freeden,273385,10325,Technische Universität Kaiserslautern
163314381,Professor Dr.-Ing. Wolfgang Breit,236329941,10325,Technische Universität Kaiserslautern
197046609,Dr.-Ing. Vikki Franke,197045803,10325,Technische Universität Kaiserslautern
15294463,Professor Dr. Peter Liggesmeyer,771881,10325,Technische Universität Kaiserslautern
1089156,Professor Dr.-Ing. Jens Hartung,273263,10325,Technische Universität Kaiserslautern
348800955,Dr. Philipp Pirro,290395253,10325,Technische Universität Kaiserslautern
290335252,Professor Dr. Benjamin Stadtmüller,290329451,10325,Technische Universität Kaiserslautern
149833116,Dr. Georg Lefkidis,189427402,10325,Technische Universität Kaiserslautern
785067,Professor Dr. Achim Ebert,771881,10325,Technische Universität Kaiserslautern
53777243,"Professor Dr. Evangelos Papaioannou, Ph.D.",290442609,10325,Technische Universität Kaiserslautern
1729976,Professor Dr.-Ing. Gerhard Steinebach,771881,10325,Technische Universität Kaiserslautern
253004085,Professorin Dr.-Ing. Charlotte Kuhn,196993949,10325,Technische Universität Kaiserslautern
9591838,Professor Dr. H. Dieter Rombach,5083740,10325,Technische Universität Kaiserslautern
12406888,Professor Dr. Sebastian Eggert,52977852,10325,Technische Universität Kaiserslautern
1086677,Professor Dr.-Ing. Theo Härder,5083746,10325,Technische Universität Kaiserslautern
