person_id,person_name,project_id_number,institution_id,institution_name
1388818,Professor Dr. Hartmut Zwahr,5151064,10351,Universität Leipzig
1069329,Professor Dr. Athanassios Giannis,272115,10351,Universität Leipzig
258174,Professor Dr. Friedbert Prüfer,272999,10351,Universität Leipzig
15928956,Dr. Judith Brinkschulte,272999,10351,Universität Leipzig
1631288,Professorin Dr. Michaela Schulz-Siegmund,125275740,10351,Universität Leipzig
1407246,Professorin Dr. Monika Wohlrab-Sahr,968612,10351,Universität Leipzig
250084562,Dr. John Heiker,250084214,10351,Universität Leipzig
1270866,Professorin Dr. Charlotte Schubert,5322336,10351,Universität Leipzig
1581522,Professor Dr. Gerhard Brewka,272455,10351,Universität Leipzig
1426360,Professor Dr. Torsten Schöneberg,452039,10351,Universität Leipzig
1377884,Privatdozent Dr. Hans-Gert Gräbe,272999,10351,Universität Leipzig
1037499,Professorin Dr. Birgit Dräger,270059,10351,Universität Leipzig
254820,Privatdozent Dr. Ulf Messow,270225,10351,Universität Leipzig
6686,Professorin Dr. Anita Steube,272179,10351,Universität Leipzig
1342309,Privatdozentin Dr. Cornelia Engler,270225,10351,Universität Leipzig
1450065,Professor Dr. Gerd Rudolph,272999,10351,Universität Leipzig
1855303,Dr. Andrea Berlich,61786089,10351,Universität Leipzig
1415169,Professor Dr. Harald Krautscheid,378603,10351,Universität Leipzig
1114982,Privatdozent Dr. Bernd Hunger,270225,10351,Universität Leipzig
1397380,Professor Dr. Peter Seibel,273153,10351,Universität Leipzig
1464467,Dr. Regina Metze,5151134,10351,Universität Leipzig
1842423,Privatdozentin Dr. Jane Neumann,228022302,10351,Universität Leipzig
1659153,Professor Dr. Ralf Hoffmann,272115,10351,Universität Leipzig
1267349,Professor Dr. Erich Schröger,818604,10351,Universität Leipzig
1461266,Professor Dr. Ulf Engel,968612,10351,Universität Leipzig
234756886,Dr. Agnieszka Kuc,286518848,10351,Universität Leipzig
1090066,Professor Dr. Jürgen Haase,378603,10351,Universität Leipzig
989138,Dr. Otmar Asperger,272115,10351,Universität Leipzig
1628966,Professorin Dr. Uta Kösser,5151152,10351,Universität Leipzig
1445903,Professor Dr. Erich Miersemann,272999,10351,Universität Leipzig
1220356,Professor Dr. Andreas Pöppl,5225607,10351,Universität Leipzig
1377251,Professor Dr. Friedrich Kremer,378603,10351,Universität Leipzig
320305239,Dr. Simone Cesarz,319936945,10351,Universität Leipzig
452611,Professorin Dr. Andrea A. Robitzki,452039,10351,Universität Leipzig
1708654,Professor Dr. Knut R. Asmis,273459,10351,Universität Leipzig
1259934,Professor Dr. Herbert Schmiedel,5347358,10351,Universität Leipzig
1880989,Professor Dr. Per K. Sørensen,82142759,10351,Universität Leipzig
80320500,Professorin Dr. Angelika Berlejung,80320488,10351,Universität Leipzig
1726434,Professor Dr. Michael Schaefer,452039,10351,Universität Leipzig
168534309,Dr. Rüdiger Schmidt-Grund,61826415,10351,Universität Leipzig
69567997,Professor Dr. Walter Brehm,142890189,10351,Universität Leipzig
1374982,Professor Dr. Wolfgang Gärtner,5233548,10351,Universität Leipzig
1504694,Privatdozent Dr. Helmut Knoll,270225,10351,Universität Leipzig
1172156,Professor Dr. Stephan Luckhaus,272999,10351,Universität Leipzig
232654842,Charlotte Bauer,178945343,10351,Universität Leipzig
1001453,Dr. Michael Beyer,5151060,10351,Universität Leipzig
1213828,Professor Dr. Thomas Pechmann,272179,10351,Universität Leipzig
195610958,Dr. Fabian Heck,242675213,10351,Universität Leipzig
1121472,Professor Dr. Adam Jones,968612,10351,Universität Leipzig
1296956,Professor Dr. Rüdiger Szargan,270225,10351,Universität Leipzig
1235579,Professorin Dr. Sabine Rieckhoff,5151084,10351,Universität Leipzig
244560303,Professorin Dr. Nina Topintzi,242675213,10351,Universität Leipzig
1621345,Professorin Dr. Ute Kunzmann,818604,10351,Universität Leipzig
1606443,Professor Dr. Roger Gläser,378603,10351,Universität Leipzig
1350358,Professor Dr. Reinhold Haberlandt,5225710,10351,Universität Leipzig
289782569,Dr. Sarah Ruth Sippel,289782445,10351,Universität Leipzig
1324891,Professor Dr. Gerhard Wendt,270225,10351,Universität Leipzig
1391211,Privatdozent Dr. Horst Ludger Vörtler,5225730,10351,Universität Leipzig
1136196,Professor Dr. Gotthard Klose,5347378,10351,Universität Leipzig
1005727,Professor Dr. Manfred Blessing,5175674,10351,Universität Leipzig
255128,Professor Dr. Kurt Eger,272115,10351,Universität Leipzig
1628917,Professor Dr. Wolfgang Hörner,5151100,10351,Universität Leipzig
1652352,Professor Dr. Ingo Bechmann,968539,10351,Universität Leipzig
1401418,Professor Dr. Jörg Gertel,968612,10351,Universität Leipzig
1366137,Professor Dr. Norbert Sträter,272115,10351,Universität Leipzig
1280187,Professor Dr. Hannes Siegrist,5151140,10351,Universität Leipzig
1067798,Professor Dr. Bodo Geyer,269303,10351,Universität Leipzig
1873705,Privatdozent Dr. Thomas Hase,82142759,10351,Universität Leipzig
1450669,Professor Dr. Jörg D. Jescheniak,818604,10351,Universität Leipzig
123165809,Professor Dr. Manfred Rudersdorf,82142759,10351,Universität Leipzig
1017805,Professor Dr. Ortwin Brede,270225,10351,Universität Leipzig
1841501,Dr. Alexander Weiß,5436196,10351,Universität Leipzig
39666173,Professor Dr. Michael Vohland,401668139,10351,Universität Leipzig
1374352,Professor Dr. Wolf-Dietrich Einicke,270225,10351,Universität Leipzig
1820048,Professor Dr. Michael Ziese,61949014,10351,Universität Leipzig
1242583,Professor Dr. Rudolf Rübsamen,452039,10351,Universität Leipzig
252272960,Professorin Dr. Sandhya Sundaresan,242675213,10351,Universität Leipzig
1628852,Professor Dr. Ulrich von Hehl,5151071,10351,Universität Leipzig
80299663,Dr. Ingo Breuer,5322116,10351,Universität Leipzig
1179359,Professor Dr. Thomas Magin,273495,10351,Universität Leipzig
339094056,Dr. Martin Gericke,339093756,10351,Universität Leipzig
1354966,Professor Dr. Matthias M. Müller,818604,10351,Universität Leipzig
1101613,Privatdozent Dr. Martin Helmstedt,5347469,10351,Universität Leipzig
32132120,Professor Dr. Philip Clart,289632894,10351,Universität Leipzig
262106,Privatdozentin Dr. Marlies Grunow,272115,10351,Universität Leipzig
1791545,Privatdozent Dr. Frank Stallmach,378603,10351,Universität Leipzig
1696277,Professorin Dr. Steffi Richter,968612,10351,Universität Leipzig
1097125,Professorin Dr. Evamarie Hey-Hawkins,272115,10351,Universität Leipzig
98526908,Professor Dr. Gregor Nikolaus Felix Weiß,241357988,10351,Universität Leipzig
1601704,Professorin Dr. Doris Schönefeld,242675213,10351,Universität Leipzig
1366480,Professor Dr. Joachim Reinhold,270225,10351,Universität Leipzig
1341159,Professorin Dr. Heidrun Zinecker,968612,10351,Universität Leipzig
1271937,Professorin Dr. Bärbel Schulze,272115,10351,Universität Leipzig
1492872,Professor Dr. Ullrich Heilemann,5361678,10351,Universität Leipzig
239672700,Dr. Ines Liebscher,228177064,10351,Universität Leipzig
1648451,Privatdozent Dr. Johannes Dölling,272179,10351,Universität Leipzig
1279712,Professor Dr. Klaus Sibold,272999,10351,Universität Leipzig
1641052,Professorin Dr. Annegret Nippa,5322110,10351,Universität Leipzig
1136983,Professor Dr. Hans-Peter Kleber,272115,10351,Universität Leipzig
288112998,Dr. Dieter Bayer,377207579,10351,Universität Leipzig
1000187,Professorin Dr. Annette G. Beck-Sickinger,272115,10351,Universität Leipzig
1048451,Professor Dr. Wolfgang Fach,5151090,10351,Universität Leipzig
1225564,Professor Dr. Hans-Bert Rademacher,272999,10351,Universität Leipzig
16788970,Professor Dr. Petrik Galvosas,378603,10351,Universität Leipzig
1380368,Professor Dr. Jens-Karl Eilers,452039,10351,Universität Leipzig
1210198,Professor Dr. Helmut Papp,270225,10351,Universität Leipzig
1387357,Dr. Brigitte Staudte,5347336,10351,Universität Leipzig
1819625,Privatdozent Dr. Heinz Böhlig,270225,10351,Universität Leipzig
1000789,Professor Dr. Dieter Beckert,272115,10351,Universität Leipzig
272915199,Dr. Antje Garten,339114131,10351,Universität Leipzig
112804731,Dr. Robert Günther,5366225,10351,Universität Leipzig
1464670,Professor Dr. Heinz-Werner Wollersheim,5151100,10351,Universität Leipzig
1060204,Professor Dr. Dieter Freude,270225,10351,Universität Leipzig
1197049,Professor Dr. Kurt Mühler,5151184,10351,Universität Leipzig
1207844,Professor Dr. Karl-Dieter Opp,5151184,10351,Universität Leipzig
1371332,Professor Dr. Werner Engewald,270225,10351,Universität Leipzig
1628864,Professor Dr. Matthias Middell,968612,10351,Universität Leipzig
21052325,Professor Dr. Klaus Kroy,39011260,10351,Universität Leipzig
1132810,Professorin Dr. Catharina Kiehnle,82142759,10351,Universität Leipzig
1466399,Professor Dr. Jürgen Arnhold,272115,10351,Universität Leipzig
201546403,Privatdozent Dr. Marco Koch,338335938,10351,Universität Leipzig
1045400,Professor Dr. Jürgen Engele,5220630,10351,Universität Leipzig
1230874,Professor Dr. Andreas Reichenbach,452039,10351,Universität Leipzig
1127612,Professor Dr. Jörg Kärger,270225,10351,Universität Leipzig
1584796,Professorin Dr. Katja Werthmann,289724043,10351,Universität Leipzig
191700882,Dr. Jens Blecher,232351166,10351,Universität Leipzig
1672933,Privatdozent Dr. Siegfried Fritzsche,378603,10351,Universität Leipzig
164664456,Professor Dr. Utz Dornberger,968612,10351,Universität Leipzig
1364338,Professor Dr. Jürgen Stückrad,272999,10351,Universität Leipzig
1589339,Professor Dr. Dirk van Laak,273619,10351,Universität Leipzig
1791048,Professor Dr. Matthias Schwarz,272999,10351,Universität Leipzig
1348010,Professorin Dr. Gerhild Zybatow,272179,10351,Universität Leipzig
118865223,Dr. Holger von Wenckstern,61826551,10351,Universität Leipzig
989021,Professor Dr. Thomas Arendt,452039,10351,Universität Leipzig
1377942,Professor Dr. Gerhard Heyer,272179,10351,Universität Leipzig
1349537,Professor Dr. Josef Alfons Käs,452039,10351,Universität Leipzig
228173894,Dr. Annette Horstmann,228022302,10351,Universität Leipzig
1274327,Dr. Gerhard Schwarz,5344504,10351,Universität Leipzig
1021285,Professor Dr. Tilman Butz,452039,10351,Universität Leipzig
1449615,Privatdozent Dr. Jürgen Schiller,125296275,10351,Universität Leipzig
1464391,Dr. Wilfried Heink,5347457,10351,Universität Leipzig
257249,Professor Dr. Jörg Schimmelpfennig,271303,10276,Ruhr-Universität Bochum
1319972,Professor Dr. Albrecht Wegner,5357323,10276,Ruhr-Universität Bochum
1805752,Professorin Dr.-Ing. Ilona Rolfes,336533074,10276,Ruhr-Universität Bochum
34098612,Dr. Hermann Krebs,234323538,10276,Ruhr-Universität Bochum
1178448,Professor Dr. Jürgen Margraf,24204029,10276,Ruhr-Universität Bochum
1046950,Professor Dr. Ralf Erdmann,5237322,10276,Ruhr-Universität Bochum
1759370,Professor Dr. Gerd Laures,796242,10276,Ruhr-Universität Bochum
1714042,Privatdozent Dr. Volker Mohles,48247189,10276,Ruhr-Universität Bochum
1530701,Dr. Karl-Ulrich Riemann,5398351,10276,Ruhr-Universität Bochum
1483678,Dr. Suzana Gomes Fries,211504218,10276,Ruhr-Universität Bochum
180085632,Professor Dr. Sen Cheng,180078922,10276,Ruhr-Universität Bochum
1664079,Professor Dr. Khanh Chau Le,5387727,10276,Ruhr-Universität Bochum
1172280,Professor Dr. Hermann Lübbert,273357,10276,Ruhr-Universität Bochum
1183111,Dr. Olaf Medenbach,5183268,10276,Ruhr-Universität Bochum
1459565,Professor Dr. Martin Hofmann,5398587,10276,Ruhr-Universität Bochum
1748164,Professor Dr. Eike Kiltz,200931773,10276,Ruhr-Universität Bochum
219520919,Dr. Stéphanie Cupit-Foutou,331192163,10276,Ruhr-Universität Bochum
29303026,Professor Dr. Michael Imhoff,5361698,10276,Ruhr-Universität Bochum
134347839,Professor Dr.-Ing. Michael Hübner,179125668,10276,Ruhr-Universität Bochum
1440073,Professor Dr. Christian Herrmann,5357331,10276,Ruhr-Universität Bochum
1569373,Professorin Dr. Uta Wilkens,24204029,10276,Ruhr-Universität Bochum
1611570,Privatdozent Dr. Kai Sven Erdmann,5126312,10276,Ruhr-Universität Bochum
1669576,Professor Dr. Günther Meschke,5244210,10276,Ruhr-Universität Bochum
1704948,Privatdozent Dr. Wolfgang M.J. Obermann,5282788,10276,Ruhr-Universität Bochum
1693672,Professor Dr. Klaus Hackl,5140502,10276,Ruhr-Universität Bochum
125746718,Dr. Annett Püttmann,49189492,10276,Ruhr-Universität Bochum
84047754,Privatdozent Dr. Carsten Kötting,5436789,10276,Ruhr-Universität Bochum
1295414,Professor Dr. Helmut Stumpf,5140502,10276,Ruhr-Universität Bochum
1352058,Dr. Wolfgang Kruse,5360429,10276,Ruhr-Universität Bochum
258570181,Professor Dr. Patrik Krieger,258570330,10276,Ruhr-Universität Bochum
1239848,Professor Dr. Matthias Rögner,273483,10276,Ruhr-Universität Bochum
1440499,Privatdozent Dr. Maxim Volgushev,5360409,10276,Ruhr-Universität Bochum
1841293,Dr. Matthias Pankau,5126300,10276,Ruhr-Universität Bochum
168398365,Professorin Dr. Francesca di Mare,240967567,10276,Ruhr-Universität Bochum
18573655,Dr.-Ing. Ulrich Hoppe,18573588,10276,Ruhr-Universität Bochum
51565567,Dr.-Ing. Jan Frenzel,5395356,10276,Ruhr-Universität Bochum
51360114,Professor Dr.-Ing. Markus Thewes,174187126,10276,Ruhr-Universität Bochum
230087406,Dr. Katja Kuhlmann,230087003,10276,Ruhr-Universität Bochum
259781084,Dr. Sascha Alavi,26661497,10276,Ruhr-Universität Bochum
1775841,Privatdozent Dr. Oleg Petracic,5218932,10276,Ruhr-Universität Bochum
1030403,Professor Dr. Herold Dehling,140576057,10276,Ruhr-Universität Bochum
1692437,Dr. Klaus Merz,5263788,10276,Ruhr-Universität Bochum
1017156,Professor Dr. Dietrich Braess,5338604,10276,Ruhr-Universität Bochum
1067364,Professor Dr. Klaus Gerwert,5357327,10276,Ruhr-Universität Bochum
1154544,Professor Dr. Ulrich Kück,5389693,10276,Ruhr-Universität Bochum
216045147,Professorin Dr. Barbara Sitek,141702174,10276,Ruhr-Universität Bochum
1457847,Professor Dr.-Ing. Peter Awakowicz,5438191,10276,Ruhr-Universität Bochum
1418297,Privatdozent Dr. Mathias Lübben,5357371,10276,Ruhr-Universität Bochum
1411065,Dr. Jochen Kruip,5389733,10276,Ruhr-Universität Bochum
1825304,Professor Dr. Eckhard Hofmann,5423924,10276,Ruhr-Universität Bochum
77494168,Professor Dr. Evgeny Epelbaum,77494139,10276,Ruhr-Universität Bochum
211503927,Dr.-Ing. Anxin Ma,211503879,10276,Ruhr-Universität Bochum
1236592,Professor Dr. Klaus F. Röhl,273019,10276,Ruhr-Universität Bochum
1759708,Professor Dr. Friedrich Balke,373035,10276,Ruhr-Universität Bochum
1093638,Professor Dr. Wolfgang Hengstenberg,5357367,10276,Ruhr-Universität Bochum
331190723,Dr. Stefan Suhr,331190363,10276,Ruhr-Universität Bochum
1143684,Professor Dr. Ulrich Köhler,5218896,10276,Ruhr-Universität Bochum
1376650,Professor Dr. Eckart Förster,5130586,10276,Ruhr-Universität Bochum
1245063,Professor Dr. Wolfram Sander,5126266,10276,Ruhr-Universität Bochum
1796847,Professorin Dr. Notburga Ott,271303,10276,Ruhr-Universität Bochum
83842175,Professor Dr. Nikolai Axmacher,83842098,10276,Ruhr-Universität Bochum
1668289,Dr. Klaus Neuking,5218380,10276,Ruhr-Universität Bochum
1330246,Professor Dr. Jörg Winkelmann,5402752,10276,Ruhr-Universität Bochum
262391544,"Privatdozent Dr. Arash Lavasan, Ph.D.",174188806,10276,Ruhr-Universität Bochum
1097275,Professor Dr. Rolf Heumann,273357,10276,Ruhr-Universität Bochum
1050588,Professor Dr. Martin Feigel,5126306,10276,Ruhr-Universität Bochum
198799533,Dr.-Ing. Steffen Freitag,174283216,10276,Ruhr-Universität Bochum
1024237,Professor Dr. Rolf Chini,273455,10276,Ruhr-Universität Bochum
1688468,Professor Dr. Stefan Wiese,5410509,10276,Ruhr-Universität Bochum
267047279,Professorin Dr. Annette Urban,265592318,10276,Ruhr-Universität Bochum
260091825,Dr. Anna Siffert,261151755,10276,Ruhr-Universität Bochum
1357035,Professor Dr. Hans Ulrich Simon,273185,10276,Ruhr-Universität Bochum
269990211,Dr. Arne Ludwig,269989752,10276,Ruhr-Universität Bochum
1483573,Professor Dr. Wolfgang Friederich,5387512,10276,Ruhr-Universität Bochum
1048899,Professor Dr. Andreas Faissner,273357,10276,Ruhr-Universität Bochum
183818629,Professor Dr. Thorsten Holz,200931773,10276,Ruhr-Universität Bochum
1805200,Professor Dr.-Ing. Bernd Kuhlenkötter,28525386,10276,Ruhr-Universität Bochum
1624166,Professor Dr. Christofer Frey,273019,10276,Ruhr-Universität Bochum
258212,Professor Dr. Joachim Wiemeyer,273019,10276,Ruhr-Universität Bochum
1783381,Dr. Christoph Somsen,5395290,10276,Ruhr-Universität Bochum
140187025,Dr. Andréa van Veen,5263656,10276,Ruhr-Universität Bochum
1822646,Professor Dr.-Ing. Alfred Ludwig,5218438,10276,Ruhr-Universität Bochum
258208,Professor Dr. Hans Kramer,273019,10276,Ruhr-Universität Bochum
1202406,Professor Dr.-Ing. Hans-Jürgen Niemann,5357584,10276,Ruhr-Universität Bochum
271953761,Professorin Dr. Sarah Weigelt,372147404,10276,Ruhr-Universität Bochum
79931334,Professor Dr. Christian Schwermann,315695648,10276,Ruhr-Universität Bochum
202050605,Professor Dr.-Ing. Tim Sadek,209293466,10276,Ruhr-Universität Bochum
180118536,Ursula Heiler,180101937,10276,Ruhr-Universität Bochum
157354635,Professor Dr.-Ing. Tim Sadek Hassanein,5218358,10276,Ruhr-Universität Bochum
1687920,Professor Dr.-Ing. Marcus Petermann,194650850,10276,Ruhr-Universität Bochum
259803747,Professorin Dr.-Ing. Katja Laurischkat,26661581,10276,Ruhr-Universität Bochum
15130860,Professor Dr. Wilhelm Löwenstein,24204029,10276,Ruhr-Universität Bochum
1131859,Professor Dr. Günter von Kiedrowski,5126300,10276,Ruhr-Universität Bochum
1415515,Professor Dr. Klaus Funke,273357,10276,Ruhr-Universität Bochum
1300265,Dr. Rolf Thieleczek,5167904,10276,Ruhr-Universität Bochum
1685369,Professor Dr.-Ing. Martin Hoffmann,64960046,10276,Ruhr-Universität Bochum
1124625,Professor Dr.-Ing. Jörg F. Kalthoff,5182998,10276,Ruhr-Universität Bochum
1078140,Professor Dr. Rainer Grauer,5398325,10276,Ruhr-Universität Bochum
1758740,Professor Dr. Wolfgang Schliebs,5357363,10276,Ruhr-Universität Bochum
1668629,Dr. Jörg Koch,5218994,10276,Ruhr-Universität Bochum
318915389,"Dr. Efe Kemaneci, Ph.D.",397770751,10276,Ruhr-Universität Bochum
1635688,Professor Dr. Traugott Jähnichen,273019,10276,Ruhr-Universität Bochum
240985087,Dr.-Ing. Martin Schiemann,240984650,10276,Ruhr-Universität Bochum
1420207,Dr. Hans Werner Becker,5218988,10276,Ruhr-Universität Bochum
1033119,Privatdozentin Dr. Claudia Distler,5365078,10276,Ruhr-Universität Bochum
212884769,Dr. Dirk Luggenhölscher,397765137,10276,Ruhr-Universität Bochum
1776444,Professor Dr. Jörg Renner,5183034,10276,Ruhr-Universität Bochum
261868,Professor Dr. Maxim Polyakov,273555,10276,Ruhr-Universität Bochum
215184244,Dr.-Ing. Yujiao Li,200409884,10276,Ruhr-Universität Bochum
19330412,Professorin Dr. Dorothea Kolossa,200931773,10276,Ruhr-Universität Bochum
215322810,Professorin Dr. Miriam Fritsch,215322380,10276,Ruhr-Universität Bochum
244488753,Professor Dr.-Ing. Markus Richter,240959326,10276,Ruhr-Universität Bochum
237510901,Dr. Julian Schulze,397766095,10276,Ruhr-Universität Bochum
5425,Professor Dr. Ulf Eysel,273357,10276,Ruhr-Universität Bochum
1409014,Dr.-Ing. Claus Oberste-Brandenburg,5218316,10276,Ruhr-Universität Bochum
1627519,Professor Dr.-Ing. Henning Schütte,5444847,10276,Ruhr-Universität Bochum
1747530,Professor Dr. Ralf-Peter Brinkmann,375788,10276,Ruhr-Universität Bochum
167715286,Dr. Thomas Hammerschmidt,211503067,10276,Ruhr-Universität Bochum
1574575,Professor Dr. Wolfgang Beilenhoff,5368433,10276,Ruhr-Universität Bochum
1647183,Dr. Thomas Fockenberg,5183268,10276,Ruhr-Universität Bochum
1102223,Dr. Hans-Otto Heuer,5338534,10276,Ruhr-Universität Bochum
1259029,Privatdozent Dr. Matthias Schmidt,273357,10276,Ruhr-Universität Bochum
1301269,Professor Dr.-Ing. Werner Theisen,5218450,10276,Ruhr-Universität Bochum
397038792,Professorin Dr. Clara Saraceno,397038379,10276,Ruhr-Universität Bochum
1581359,Professor Dr. Andreas Dirk Wieck,272131,10276,Ruhr-Universität Bochum
262100,Professor Dr. Michael Wilhelm,273361,10276,Ruhr-Universität Bochum
259799389,Dr. Denis Eremin,177939603,10276,Ruhr-Universität Bochum
1845601,Professor Dr. Achim von Keudell,5438191,10276,Ruhr-Universität Bochum
258013683,Professor Dr. Gregor Leander,200931773,10276,Ruhr-Universität Bochum
1805114,Professor Dr. Ingo Steinbach,5395290,10276,Ruhr-Universität Bochum
1842393,Professor Dr. Joachim Wirth,273635,10276,Ruhr-Universität Bochum
253311531,Professorin Dr. Christina Pöpper,200931773,10276,Ruhr-Universität Bochum
232677698,Professorin Dr. Kristina Tschulik,331085229,10276,Ruhr-Universität Bochum
1825238,Dr. Ines Kubigsteltig,5389701,10276,Ruhr-Universität Bochum
201697243,Professor Dr. Markus Werning,274877981,10276,Ruhr-Universität Bochum
1473487,Professor Dr. Karl-Heinz Braunewell,5150138,10276,Ruhr-Universität Bochum
1828812,Professor Dr. Ilya Eremin,49148081,10276,Ruhr-Universität Bochum
245386027,Dr. Christian Merten,331085229,10276,Ruhr-Universität Bochum
1016247,Professorin Dr. Beate Brand-Saberi,455540,10276,Ruhr-Universität Bochum
1704561,Professor Dr. Markus Reineke,375986,10276,Ruhr-Universität Bochum
1607628,Professor Dr. Uwe Czarnetzki,5386525,10276,Ruhr-Universität Bochum
30613814,Professor Dr. Frank Schulz,321933041,10276,Ruhr-Universität Bochum
1017328,Professor Dr.-Ing. Rolf Breitenbücher,5420628,10276,Ruhr-Universität Bochum
1362814,Professor Dr. Gerhard Knieper,5213408,10276,Ruhr-Universität Bochum
1423363,Professor Dr. Thomas Happe,5423930,10276,Ruhr-Universität Bochum
1617896,Professor Dr.-Ing. Michael Alber,15909043,10276,Ruhr-Universität Bochum
1647092,Dr. Michael L. Jost,5183052,10276,Ruhr-Universität Bochum
1092443,Professor Dr. Ludwig G. Heilmeyer,5357335,10276,Ruhr-Universität Bochum
1416822,Professor Dr.-Ing. Gunther Eggeler,5183256,10276,Ruhr-Universität Bochum
1212433,Professor Dr. Josef Pelzl,5218956,10276,Ruhr-Universität Bochum
1154896,Professor Dr.-Ing. Ulrich Kunze,5218968,10276,Ruhr-Universität Bochum
1055404,Professor Dr. Cay Folkers,271303,10276,Ruhr-Universität Bochum
1240731,Dr. Klaus Röller,5183070,10276,Ruhr-Universität Bochum
1411053,Dr. Eckard Nordhoff,141702174,10276,Ruhr-Universität Bochum
987523,Professor Dr. Uwe Abresch,5338716,10276,Ruhr-Universität Bochum
1407381,Dr.-Ing. Diethard König,5182950,10276,Ruhr-Universität Bochum
1660958,Professorin Dr. Marion Steven,26663790,10276,Ruhr-Universität Bochum
185961194,Professorin Dr. Anna Tuschling,265592318,10276,Ruhr-Universität Bochum
371922770,Dr. Roland Pusch,371903404,10276,Ruhr-Universität Bochum
261866,Dr. Klaus Peters,273555,10276,Ruhr-Universität Bochum
1803914,Dr. Alexander Birkner,5263720,10276,Ruhr-Universität Bochum
194911290,Professor Dr. Oliver Fahle,265592318,10276,Ruhr-Universität Bochum
270557631,Dr. Stefan Nemirovski,331190363,10276,Ruhr-Universität Bochum
259799756,Professorin Dr.-Ing. Beate Bender,26661525,10276,Ruhr-Universität Bochum
258537,Professor Dr. Lothar Gerritzen,273185,10276,Ruhr-Universität Bochum
1110118,Professor Dr. Michael Hollmann,273357,10276,Ruhr-Universität Bochum
193714436,Dr.-Ing. Alfred Hypki,193714221,10276,Ruhr-Universität Bochum
1394302,Professor Dr. Ulrich Wiedner,77513854,10276,Ruhr-Universität Bochum
1030496,Professor Dr. Ralf-Jürgen Dettmar,273455,10276,Ruhr-Universität Bochum
1441891,Professor Dr. Stefan Rieger,5137216,10276,Ruhr-Universität Bochum
1619794,Professor Dr. Norbert Ricken,118660364,10276,Ruhr-Universität Bochum
1254143,Professor Dr. Reinhard Schlickeiser,273455,10276,Ruhr-Universität Bochum
262395273,Dr.-Ing. Britta Schößer,262395288,10276,Ruhr-Universität Bochum
1771911,Professor Dr. Tobias Schlicht,274877981,10276,Ruhr-Universität Bochum
1180539,Professor Dr. Dominik Marx,5267680,10276,Ruhr-Universität Bochum
241358134,Dr. Axel Bücher,241357988,10276,Ruhr-Universität Bochum
1739547,Professor Dr.-Ing. Marc Wichern,237291317,10276,Ruhr-Universität Bochum
1241449,Professor Dr. Fritz Rummel,5182992,10276,Ruhr-Universität Bochum
227421311,Dr.-Ing. Carsten Brenner,336599864,10276,Ruhr-Universität Bochum
1647099,Dr. Johannes Duyster,5183082,10276,Ruhr-Universität Bochum
1272917,Professor Dr. Gustav Schweiger,272051,10276,Ruhr-Universität Bochum
1452264,Professor Dr. Henning Soltwisch,5398355,10276,Ruhr-Universität Bochum
202788487,Dr. Christian Josef Merz,371984847,10276,Ruhr-Universität Bochum
257460622,Professor Dr. Christoph Thäle,265592081,10276,Ruhr-Universität Bochum
1629299,Privatdozent Dr. Dirk Jancke,179946772,10276,Ruhr-Universität Bochum
92219995,Professorin Dr. Yvonne Wübben,265592318,10276,Ruhr-Universität Bochum
397266035,Dr. Dominik Andre Megger,141702174,10276,Ruhr-Universität Bochum
1320318,Professor Dr. Kurt Westerholt,5219024,10276,Ruhr-Universität Bochum
1366963,Privatdozent Dr. Thomas Steuber,5123468,10276,Ruhr-Universität Bochum
2026486,Professor Dr. Jörg Schwenk,200931773,10276,Ruhr-Universität Bochum
15949647,Dr. Kasper David Fischer,15949513,10276,Ruhr-Universität Bochum
315352818,Dr. Katharina Spoida,371983869,10276,Ruhr-Universität Bochum
1846558,Professor Dr.-Ing. Rüdiger Höffer,5357650,10276,Ruhr-Universität Bochum
1844590,Dr. Nicolai Bissantz,140576213,10276,Ruhr-Universität Bochum
1315063,Professorin Dr. Petra Wahle,273357,10276,Ruhr-Universität Bochum
1286570,Professor Dr.-Ing. Friedhelm Stangenberg,5357600,10276,Ruhr-Universität Bochum
1516382,Professorin Dr. Denise Manahan-Vaughan,273357,10276,Ruhr-Universität Bochum
1029835,Professor Dr. Rolf Dermietzel,273357,10276,Ruhr-Universität Bochum
1422144,Privatdozent Dr. Götz Bucher,5126412,10276,Ruhr-Universität Bochum
1303212,Professor Dr. Achim Trebst,5389721,10276,Ruhr-Universität Bochum
20394961,Professorin Dr. Astrid Deuber-Mankowsky,265592318,10276,Ruhr-Universität Bochum
1099633,Professor Dr. Peter Heinzner,5338610,10276,Ruhr-Universität Bochum
1757803,Privatdozent Dr. Peter Reusch,271543,10276,Ruhr-Universität Bochum
1272074,Professor Dr. Wolfgang Schuhmann,5218346,10276,Ruhr-Universität Bochum
1671721,Dr. Thomas Eimüller,17404371,10276,Ruhr-Universität Bochum
1479376,Professor Dr. Konstantin Efetov,5128144,10276,Ruhr-Universität Bochum
