person_id,person_name,project_id_number,institution_id,institution_name
1389211,Professor Dr. Stefan Wagner,5149582,10047,Ruprecht-Karls-Universität Heidelberg
250787243,Dr. Stefania Petra,159280219,10047,Ruprecht-Karls-Universität Heidelberg
1645978,Dr. Maria Isabel Geli,270995,10047,Ruprecht-Karls-Universität Heidelberg
1379560,Professor Dr. Michael Brunner,270995,10047,Ruprecht-Karls-Universität Heidelberg
1567628,Professor Dr. Stefan M. Maul,5376024,10047,Ruprecht-Karls-Universität Heidelberg
1628469,Professor Dr. Marcus Nüsser,39092596,10047,Ruprecht-Karls-Universität Heidelberg
229560518,Dr. Rainer Stamen,229556894,10047,Ruprecht-Karls-Universität Heidelberg
1377809,Professor Dr. Peter Bastian,273305,10047,Ruprecht-Karls-Universität Heidelberg
1702345,Professor Dr. Jörg Pross,5345753,10047,Ruprecht-Karls-Universität Heidelberg
263000415,Professorin Dr. Yana Vaynzof,327476420,10047,Ruprecht-Karls-Universität Heidelberg
250762,Professor Dr. P. Glässel,269145,10047,Ruprecht-Karls-Universität Heidelberg
1053666,Professor Dr. Peter Findeisen,162572700,10047,Ruprecht-Karls-Universität Heidelberg
21644203,Professor Dr. Günter Leypoldt,285767768,10047,Ruprecht-Karls-Universität Heidelberg
31518686,Professor Dr. Dietmar Schloss,285767768,10047,Ruprecht-Karls-Universität Heidelberg
183111173,Dr. Nicole Bobrowski,183111571,10047,Ruprecht-Karls-Universität Heidelberg
42779426,Professorin Dr. Monica Juneja,39092596,10047,Ruprecht-Karls-Universität Heidelberg
250770,Professor Dr. Hans J. Specht,269145,10047,Ruprecht-Karls-Universität Heidelberg
200204759,Dr. Rodney Ast,203283326,10047,Ruprecht-Karls-Universität Heidelberg
1498185,Professorin Dr. Ute Hüsken,5376004,10047,Ruprecht-Karls-Universität Heidelberg
1019634,Professor Dr. Hermann Bujard,5188008,10047,Ruprecht-Karls-Universität Heidelberg
1479969,Professor Dr. Roland Eils,273611,10047,Ruprecht-Karls-Universität Heidelberg
277638932,Friederike Elias,277635875,10047,Ruprecht-Karls-Universität Heidelberg
277616672,Dr. Friederike Schücking-Jungblut,203328365,10047,Ruprecht-Karls-Universität Heidelberg
1556417,Professor Dr. Nikolas Jaspert,24204029,10047,Ruprecht-Karls-Universität Heidelberg
1627604,Professor Dr. Andreas Just,5149390,10047,Ruprecht-Karls-Universität Heidelberg
317872374,Dr. Anton Khmelinskii,224742064,10047,Ruprecht-Karls-Universität Heidelberg
18816654,Professorin Dr. Vera Nünning,134041380,10047,Ruprecht-Karls-Universität Heidelberg
1192426,Professor Dr. Werner A. Müller,272617,10047,Ruprecht-Karls-Universität Heidelberg
1820548,Privatdozent Dr. Veit Riechmann,5420688,10047,Ruprecht-Karls-Universität Heidelberg
1703971,"Dr. Stefan Fischer, Ph.D.",5382603,10047,Ruprecht-Karls-Universität Heidelberg
1025329,Professorin Dr. Christine Elizabeth Clayton,271699,10047,Ruprecht-Karls-Universität Heidelberg
1080917,Professorin Dr. Eva Gutheil,273305,10047,Ruprecht-Karls-Universität Heidelberg
31516988,Privatdozentin Dr. Yuxi Feng,214631492,10047,Ruprecht-Karls-Universität Heidelberg
102766274,Privatdozentin Dr. Luminita Nicoleta Mihaila,5451750,10047,Ruprecht-Karls-Universität Heidelberg
1023554,Professor Dr. Max Camenzind,5149570,10047,Ruprecht-Karls-Universität Heidelberg
256032132,Dr. Valeria Pettorino,28649101,10047,Ruprecht-Karls-Universität Heidelberg
64447854,Professorin Dr. Melanie Trede,39092596,10047,Ruprecht-Karls-Universität Heidelberg
1224728,Professor Dr. Edgar Radtke,269889,10047,Ruprecht-Karls-Universität Heidelberg
110919061,Dr. Laurence Ettwiller,110898895,10047,Ruprecht-Karls-Universität Heidelberg
209307512,Dr. Anna Pasquali,189712075,10047,Ruprecht-Karls-Universität Heidelberg
267441894,Professor Dr. Fred Jendrzejewski,317278855,10047,Ruprecht-Karls-Universität Heidelberg
251575,Professorin Dr. Beate Glauser,269889,10047,Ruprecht-Karls-Universität Heidelberg
1048830,Professor Dr. H. Dariush Fahimi,5089784,10047,Ruprecht-Karls-Universität Heidelberg
992292,Professor Dr. Hilmar Bading,273467,10047,Ruprecht-Karls-Universität Heidelberg
1075765,Professor Dr. Michael Grunze,5149079,10047,Ruprecht-Karls-Universität Heidelberg
157048078,Professor Dr. Ludger Lieb,178035969,10047,Ruprecht-Karls-Universität Heidelberg
1492376,Professor Dr. Dieter W. Heermann,24838972,10047,Ruprecht-Karls-Universität Heidelberg
1386005,Professor Dr. Hermann Rost,5354721,10047,Ruprecht-Karls-Universität Heidelberg
250754,Professor Dr. E. Kluge,269145,10047,Ruprecht-Karls-Universität Heidelberg
1707518,Privatdozent Dr. Burckhard Dücker,5376102,10047,Ruprecht-Karls-Universität Heidelberg
1031265,Professorin Dr. Gita Dharampal-Frick,15643010,10047,Ruprecht-Karls-Universität Heidelberg
1706350,Dr. Joannes Snoek,5376046,10047,Ruprecht-Karls-Universität Heidelberg
1619710,Professor Dr. Gebhard Böckle,51216742,10047,Ruprecht-Karls-Universität Heidelberg
1230593,Professor Dr. Gerhard Reinelt,273305,10047,Ruprecht-Karls-Universität Heidelberg
256584651,Professor Dr. Joerg Jaeckel,256584074,10047,Ruprecht-Karls-Universität Heidelberg
1770249,Professor Dr. Jan Martin Pawlowski,317235864,10047,Ruprecht-Karls-Universität Heidelberg
41079526,Professorin Dr. Karen Bieback,214631492,10047,Ruprecht-Karls-Universität Heidelberg
1177992,Professor Dr. Joseph Maran,39092596,10047,Ruprecht-Karls-Universität Heidelberg
1624689,Professorin Dr. Rebecca Wade,39072701,10047,Ruprecht-Karls-Universität Heidelberg
170587739,Privatdozent Dr. Timo Weigand,28465040,10047,Ruprecht-Karls-Universität Heidelberg
1383699,Professor Dr. Jochen Christian Kuhse,5220656,10047,Ruprecht-Karls-Universität Heidelberg
250756,Professor Dr. Karlheinz Meier,269145,10047,Ruprecht-Karls-Universität Heidelberg
16502275,Professorin Dr. Beatrix Busse,285767768,10047,Ruprecht-Karls-Universität Heidelberg
27952972,Professor Dr. Hans-Christian Schultz-Coulon,374897,10047,Ruprecht-Karls-Universität Heidelberg
1328801,Professor Dr. Felix Wilhelm Theodor Wieland,270995,10047,Ruprecht-Karls-Universität Heidelberg
1796936,Privatdozent Dr. Kerry Lee Tucker,5405539,10047,Ruprecht-Karls-Universität Heidelberg
1721362,Professor Dr. Christian Witschel,5376020,10047,Ruprecht-Karls-Universität Heidelberg
251960959,Dr. Tobias Endler,285767768,10047,Ruprecht-Karls-Universität Heidelberg
1252949,Professor Dr. Elmar Schiebel,818879,10047,Ruprecht-Karls-Universität Heidelberg
2035431,Professorin Dr. Barbara Paech,39072701,10047,Ruprecht-Karls-Universität Heidelberg
277607303,Dr. Julia Lougovaya-Ast,277605777,10047,Ruprecht-Karls-Universität Heidelberg
203325468,Dr. Christian Schneider,203325316,10047,Ruprecht-Karls-Universität Heidelberg
257921,Professor Dr. Norbert Herrmann,269145,10047,Ruprecht-Karls-Universität Heidelberg
1425654,Professor Dr. Subrata K. Mitra,39092596,10047,Ruprecht-Karls-Universität Heidelberg
1861437,Professor Dr. Dirk-Peter Herten,5382607,10047,Ruprecht-Karls-Universität Heidelberg
233067818,Professor Dr. Klaus Reygers,252537693,10047,Ruprecht-Karls-Universität Heidelberg
171030941,Professor Dr. Helmut K. Anheier,39276674,10047,Ruprecht-Karls-Universität Heidelberg
12631986,Professor Dr. Jürgen Paul Schwindt,203339146,10047,Ruprecht-Karls-Universität Heidelberg
9597605,Professor Michael Hebgen,236235624,10047,Ruprecht-Karls-Universität Heidelberg
189719626,Dr. Guido Thimm,189719518,10047,Ruprecht-Karls-Universität Heidelberg
236882549,Professor Dr. Filip Sadlo,164921102,10047,Ruprecht-Karls-Universität Heidelberg
215975075,Professor Dr. Michael Gertz,39072701,10047,Ruprecht-Karls-Universität Heidelberg
988252,Professor Dr. Jörn Albrecht,269889,10047,Ruprecht-Karls-Universität Heidelberg
9627727,Professor Dr. Ulrich Uwer,374897,10047,Ruprecht-Karls-Universität Heidelberg
198780817,Professor Dr. Joachim Kurtz,39092596,10047,Ruprecht-Karls-Universität Heidelberg
1378989,Professor Dr. Konrad Beyreuther,272155,10047,Ruprecht-Karls-Universität Heidelberg
392508660,Dr. Claudia Strauch,232955966,10047,Ruprecht-Karls-Universität Heidelberg
1100082,Professor Dr. Rüdiger Hell,272273,10047,Ruprecht-Karls-Universität Heidelberg
200342559,Dr. Gislene Pereira,39338214,10047,Ruprecht-Karls-Universität Heidelberg
1121782,Professor Dr. Stefan Jordan,189719518,10047,Ruprecht-Karls-Universität Heidelberg
1537127,Professorin Dr. Johanna Stachel,269145,10047,Ruprecht-Karls-Universität Heidelberg
1367996,Professor Dr. Walter Nickel,270995,10047,Ruprecht-Karls-Universität Heidelberg
163904441,Privatdozent Dr. Martin Both,24470448,10047,Ruprecht-Karls-Universität Heidelberg
1830654,Professorin Dr. Petra Tegeder,12877646,10047,Ruprecht-Karls-Universität Heidelberg
1213647,Professorin Dr. Gabriele Petersen,272155,10047,Ruprecht-Karls-Universität Heidelberg
1356093,Professorin Dr. Janet Blümel,5382611,10047,Ruprecht-Karls-Universität Heidelberg
1543797,Professor Dr. Hans-Robert Volpp,5279668,10047,Ruprecht-Karls-Universität Heidelberg
277537428,Dr. Ludwig Meier,203278954,10047,Ruprecht-Karls-Universität Heidelberg
1193950,Professor Dr. Peter-Christian Müller-Graff,273405,10047,Ruprecht-Karls-Universität Heidelberg
1812024,Professorin Dr. Annette Frank,134040935,10047,Ruprecht-Karls-Universität Heidelberg
1098693,"Professor Dr. Markus Hecker, Ph.D.",271917,10047,Ruprecht-Karls-Universität Heidelberg
1093542,Professor Dr. Günter Helmchen,273575,10047,Ruprecht-Karls-Universität Heidelberg
51646471,Privatdozentin Dr. Susan Richter,39092596,10047,Ruprecht-Karls-Universität Heidelberg
263940145,Professor Dr. Robert Folger,277618794,10047,Ruprecht-Karls-Universität Heidelberg
1224712,Professor Dr. Rolf Rannacher,273305,10047,Ruprecht-Karls-Universität Heidelberg
78498491,Professorin Dr. Anna Marciniak-Czochra,39072701,10047,Ruprecht-Karls-Universität Heidelberg
1844046,Professor Dr. Bernd F. Straub,273575,10047,Ruprecht-Karls-Universität Heidelberg
1026321,Professor Dr. Peter Comba,273575,10047,Ruprecht-Karls-Universität Heidelberg
1486016,Professor Dr. Jan Christian Gertz,272905,10047,Ruprecht-Karls-Universität Heidelberg
5324,Professor Dr. Bernd Bukau,5093938,10047,Ruprecht-Karls-Universität Heidelberg
12651588,Professorin Dr. Susanne Enderwitz,15663331,10047,Ruprecht-Karls-Universität Heidelberg
1363807,Professor Dr. Franz Wegner,270849,10047,Ruprecht-Karls-Universität Heidelberg
1176368,Professor Dr. Augusto Mangini,271503,10047,Ruprecht-Karls-Universität Heidelberg
203286386,Dr. Tobias Frese,203286220,10047,Ruprecht-Karls-Universität Heidelberg
28484415,Privatdozent Dr. Michael Doran,28484420,10047,Ruprecht-Karls-Universität Heidelberg
1329242,Professor Dr. Michael Wink,272155,10047,Ruprecht-Karls-Universität Heidelberg
1375553,Professorin Dr. Irmgard Sinning,270995,10047,Ruprecht-Karls-Universität Heidelberg
141150523,Dr. Hagen Wende,14866011,10047,Ruprecht-Karls-Universität Heidelberg
250768,Professor Dr. D. Pelte,269145,10047,Ruprecht-Karls-Universität Heidelberg
1660207,Professor Dr. Gregor Ahn,5376046,10047,Ruprecht-Karls-Universität Heidelberg
203236994,Professor Dr. André Schöning,229556894,10047,Ruprecht-Karls-Universität Heidelberg
988771,Professor Dr. Immo Appenzeller,5149366,10047,Ruprecht-Karls-Universität Heidelberg
5946,Professor Dr. Klaus J. Mattheier,269889,10047,Ruprecht-Karls-Universität Heidelberg
1225543,Professor Dr. Thomas Rausch,272155,10047,Ruprecht-Karls-Universität Heidelberg
250764,Professor Dr. Klaus Jungmann,269145,10047,Ruprecht-Karls-Universität Heidelberg
1588602,Professor Dr. Nelson Cartagena,269889,10047,Ruprecht-Karls-Universität Heidelberg
250467,Professor Dr. Bernhard Dobberstein,270995,10047,Ruprecht-Karls-Universität Heidelberg
1792119,Dr. Francesca Ciccolini,273467,10047,Ruprecht-Karls-Universität Heidelberg
251783,Professor Dr. Theo Sundermeier,270649,10047,Ruprecht-Karls-Universität Heidelberg
1120244,Professor Dr. Dieter Jeckel,5354121,10047,Ruprecht-Karls-Universität Heidelberg
1171694,Professor Dr. Jens Lüdtke,269889,10047,Ruprecht-Karls-Universität Heidelberg
259966,Professor Dr. Henry Keazor,271237,10047,Ruprecht-Karls-Universität Heidelberg
1236989,Professor Dr. David G. Robinson,272155,10047,Ruprecht-Karls-Universität Heidelberg
16952370,Dr. Ulrike Engel,260450941,10047,Ruprecht-Karls-Universität Heidelberg
1748761,Professor Dr. Olaf Bubenzer,5354504,10047,Ruprecht-Karls-Universität Heidelberg
45236379,Professor Dr. Joachim E. Fischer,324164820,10047,Ruprecht-Karls-Universität Heidelberg
257516425,Dr. Carmen Nussbaum-Krammer,317826678,10047,Ruprecht-Karls-Universität Heidelberg
1585271,Professorin Dr. Ursula Kummer,39072701,10047,Ruprecht-Karls-Universität Heidelberg
1161828,Professor Dr. Lothar Ledderose,273201,10047,Ruprecht-Karls-Universität Heidelberg
259914731,Dr. Nitin Agarwal,259914356,10047,Ruprecht-Karls-Universität Heidelberg
397702711,Dr. Doris Höglinger,397702706,10047,Ruprecht-Karls-Universität Heidelberg
26314468,Professor Dr. Luca Amendola,15499703,10047,Ruprecht-Karls-Universität Heidelberg
257625,Professor Dr. Hans-Ullrich Schairer,271699,10047,Ruprecht-Karls-Universität Heidelberg
168782446,Professor Dr. Jan Siemens,278360942,10047,Ruprecht-Karls-Universität Heidelberg
1137094,Professor Dr. Joachim Knappe,5354069,10047,Ruprecht-Karls-Universität Heidelberg
1380466,Professor Dr. Markus Enders,273575,10047,Ruprecht-Karls-Universität Heidelberg
1060073,Dr. Rainer Wolfram Frank,5354149,10047,Ruprecht-Karls-Universität Heidelberg
1109892,Professor Dr. Thomas W. Holstein,271975,10047,Ruprecht-Karls-Universität Heidelberg
12591255,Professor Dr. Jan Johannes,232955966,10047,Ruprecht-Karls-Universität Heidelberg
5739,Professor Dr. Willi Jäger,273305,10047,Ruprecht-Karls-Universität Heidelberg
1093104,Professor Dr. Richard Herrmann,271699,10047,Ruprecht-Karls-Universität Heidelberg
195031167,Professor Dr. Hans Knüpfer,233523641,10047,Ruprecht-Karls-Universität Heidelberg
278166466,Dr. Vijayan Gangadharan,278166578,10047,Ruprecht-Karls-Universität Heidelberg
63341914,Professorin Dr. Inga Mai Groote,63341852,10047,Ruprecht-Karls-Universität Heidelberg
1061860,Professor Dr. Burkhard Fuchs,5149514,10047,Ruprecht-Karls-Universität Heidelberg
15295053,Professorin Dr. Andrea Jördens,203284511,10047,Ruprecht-Karls-Universität Heidelberg
22995666,Professorin Dr. Adelheid Cerwenka,259332240,10047,Ruprecht-Karls-Universität Heidelberg
1283117,Professor Dr. Thomas Söllner,818879,10047,Ruprecht-Karls-Universität Heidelberg
1778692,Professor Dr. Enno Giele,277613158,10047,Ruprecht-Karls-Universität Heidelberg
995932,Professor Dr. Thilo Bechstädt,271503,10047,Ruprecht-Karls-Universität Heidelberg
1179220,Professor Dr. Matthias Peter Mayer,5093938,10047,Ruprecht-Karls-Universität Heidelberg
988064,Professor Dr. Rainer Altherr,271503,10047,Ruprecht-Karls-Universität Heidelberg
1122727,Professor Dr. Wilhelm Just,270995,10047,Ruprecht-Karls-Universität Heidelberg
1010059,Professor Dr. Hans Georg Bock,273305,10047,Ruprecht-Karls-Universität Heidelberg
1647803,Privatdozent Dr. Martin Thunert,285767768,10047,Ruprecht-Karls-Universität Heidelberg
1304967,Professor Dr. Werner M. Tscharnuter,5149400,10047,Ruprecht-Karls-Universität Heidelberg
189524778,Dr. Hans-Günter Ludwig,189524646,10047,Ruprecht-Karls-Universität Heidelberg
1702370,Professor Dr. Harald Klüter,5454960,10047,Ruprecht-Karls-Universität Heidelberg
247295951,Dr. Matthias Müller-Eschner,225106543,10047,Ruprecht-Karls-Universität Heidelberg
1612312,Professor Dr. Jürgen Eichberger,5394364,10047,Ruprecht-Karls-Universität Heidelberg
1773715,Professor Dr. Marc Freichel,5384195,10047,Ruprecht-Karls-Universität Heidelberg
1284904,Professor Dr. Rainer Spurzem,5149390,10047,Ruprecht-Karls-Universität Heidelberg
1355823,Dr. Patrick Lorenz,5354113,10047,Ruprecht-Karls-Universität Heidelberg
186214271,Professor Dr. Marius Lemberg,224744743,10047,Ruprecht-Karls-Universität Heidelberg
1395613,Professor Dr. Joerg Gengnagel,5376044,10047,Ruprecht-Karls-Universität Heidelberg
1706491,Privatdozent Dr. Andreas H. Wagner,5449415,10047,Ruprecht-Karls-Universität Heidelberg
253021,Professor Dr. Ekkehard K. F. Bautz,272155,10047,Ruprecht-Karls-Universität Heidelberg
250758,Professor Dr. A. Putzer,269145,10047,Ruprecht-Karls-Universität Heidelberg
1189635,Dr. Claus Möllenhoff,5149514,10047,Ruprecht-Karls-Universität Heidelberg
1167784,Professor Dr. Gerald Linti,273575,10047,Ruprecht-Karls-Universität Heidelberg
29180747,Professor Dr. Jan Lohmann,29180727,10047,Ruprecht-Karls-Universität Heidelberg
1310908,Professor Dr. Alfred Völkl,5089750,10047,Ruprecht-Karls-Universität Heidelberg
215873944,"Professor Dr. Harald Fuess, Ph.D.",39092596,10047,Ruprecht-Karls-Universität Heidelberg
1264008,Professor Dr. Heinz-Friedrich Schöler,271503,10047,Ruprecht-Karls-Universität Heidelberg
317281975,Privatdozent Dr. Tilman Enss,317282011,10047,Ruprecht-Karls-Universität Heidelberg
1565311,Privatdozent Dr. Matthias Hofmann,273575,10047,Ruprecht-Karls-Universität Heidelberg
1294877,Professorin Dr. Sabine Strahl,5168964,10047,Ruprecht-Karls-Universität Heidelberg
6350,Professor Dr. Bernd Schneidmüller,271381,10047,Ruprecht-Karls-Universität Heidelberg
267466362,Dr. Christoph Körber,267465703,10047,Ruprecht-Karls-Universität Heidelberg
318130455,Professor Dr. Nikolaus Dietrich,318127270,10047,Ruprecht-Karls-Universität Heidelberg
253027,Professor Dr. K. Melvyn Little,272155,10047,Ruprecht-Karls-Universität Heidelberg
257153047,Dr. Alexander Karl Rothkopf,317300873,10047,Ruprecht-Karls-Universität Heidelberg
1601398,Dr. Thomas Ruppert,5424333,10047,Ruprecht-Karls-Universität Heidelberg
1219648,Professorin Dr. Gabriele Elisabeth Pollerberg,272617,10047,Ruprecht-Karls-Universität Heidelberg
50684184,Dr. Gergana Dobreva,24676099,10047,Ruprecht-Karls-Universität Heidelberg
1409148,Privatdozent Dr. Maarten DeKieviet,269145,10047,Ruprecht-Karls-Universität Heidelberg
242773837,Dr. Thomas Reichelt,242588615,10047,Ruprecht-Karls-Universität Heidelberg
165254862,Professorin Dr. Jana Zaumseil,806681,10047,Ruprecht-Karls-Universität Heidelberg
1544280,Dr. Elisabeth Wallhäußer-Franke,5344994,10047,Ruprecht-Karls-Universität Heidelberg
1393200,Professor Dr. Mario Trieloff,271503,10047,Ruprecht-Karls-Universität Heidelberg
1853581,Professor Dr. Oliver Kann,5360381,10047,Ruprecht-Karls-Universität Heidelberg
371177,Professor Dr. Jürgen Berges,200381534,10047,Ruprecht-Karls-Universität Heidelberg
1452290,Professor Dr. Klaus Tanner,5361330,10047,Ruprecht-Karls-Universität Heidelberg
255085118,Professorin Dr. Susanne Westhoff,229556894,10047,Ruprecht-Karls-Universität Heidelberg
1056204,Professor Dr. Werner Fricke,5344760,10047,Ruprecht-Karls-Universität Heidelberg
317876890,Professor Dr. Claudio Joazeiro,317826173,10047,Ruprecht-Karls-Universität Heidelberg
1089636,Privatdozentin Dr. Ingrid G. Haas,5354097,10047,Ruprecht-Karls-Universität Heidelberg
1209728,Professor Dr. Baldur Panzer,269889,10047,Ruprecht-Karls-Universität Heidelberg
1062820,Professor Dr. Hans-Peter Gail,5149400,10047,Ruprecht-Karls-Universität Heidelberg
6638,Professor Dr. Jürgen Wolfrum,272155,10047,Ruprecht-Karls-Universität Heidelberg
250760,Professor Dr. Peter Bock,269145,10047,Ruprecht-Karls-Universität Heidelberg
1528384,Professor Dr. Andreas Quirrenbach,189525432,10047,Ruprecht-Karls-Universität Heidelberg
179254535,Privatdozentin Dr. Geneviève A. Parmentier,189651601,10047,Ruprecht-Karls-Universität Heidelberg
1411750,Professor Dr. Gert Fricker,272155,10047,Ruprecht-Karls-Universität Heidelberg
1727088,Professor Dr. Henning Plessner,5394282,10047,Ruprecht-Karls-Universität Heidelberg
1824986,Professor Dr. Thomas Korff,273595,10047,Ruprecht-Karls-Universität Heidelberg
252728,Dr. Rainer Frank,271699,10047,Ruprecht-Karls-Universität Heidelberg
258483,Professor Dr. Rudolf Schubert,269007,10047,Ruprecht-Karls-Universität Heidelberg
6252,Professor Dr. Kurt Roth,271503,10047,Ruprecht-Karls-Universität Heidelberg
1684201,Professorin Dr. Christiane Brosius,5376008,10047,Ruprecht-Karls-Universität Heidelberg
115487523,Dr. Markus Wirtz,224745035,10047,Ruprecht-Karls-Universität Heidelberg
1849563,Professor Dr. Manfred Salmhofer,272999,10047,Ruprecht-Karls-Universität Heidelberg
97072186,Professor Dr. Zeno Enders,174824510,10047,Ruprecht-Karls-Universität Heidelberg
1411251,Professor Dr. Andreas Draguhn,273467,10047,Ruprecht-Karls-Universität Heidelberg
385789334,Dr. Charlotta Funaya,258371140,10047,Ruprecht-Karls-Universität Heidelberg
1023719,Professor Dr. Lorenz S. Cederbaum,273305,10047,Ruprecht-Karls-Universität Heidelberg
1765702,Dr. Srilata Müller,5376004,10047,Ruprecht-Karls-Universität Heidelberg
1656464,Dr. Jens-Arne Dickmann,203278954,10047,Ruprecht-Karls-Universität Heidelberg
278191782,Professor Dr. Kai Lämmerhirt,324937162,10047,Ruprecht-Karls-Universität Heidelberg
1836180,Dr. Klemens Wild,5424276,10047,Ruprecht-Karls-Universität Heidelberg
250766,Professor Dr. J. von Krogh,269145,10047,Ruprecht-Karls-Universität Heidelberg
1546850,Professor Dr. Stefan Weinfurter,5376036,10047,Ruprecht-Karls-Universität Heidelberg
1868216,Dr. Andrei Rozov,273467,10047,Ruprecht-Karls-Universität Heidelberg
193237406,Privatdozent Dr. Stefan Porubsky,193237015,10047,Ruprecht-Karls-Universität Heidelberg
111431259,Dr. Uta Binzen,214631492,10047,Ruprecht-Karls-Universität Heidelberg
189523534,Dr. Sonia Duffau,189523351,10047,Ruprecht-Karls-Universität Heidelberg
1416077,Privatdozent Dr. Matthias Seedorf,270995,10047,Ruprecht-Karls-Universität Heidelberg
236332769,Dr. Geneviève Permentier,189712075,10047,Ruprecht-Karls-Universität Heidelberg
1645046,Professor Dr. Marc Wolf Sütterlin,324164820,10047,Ruprecht-Karls-Universität Heidelberg
277539583,Privatdozent Dr. Tino Licht,277539528,10047,Ruprecht-Karls-Universität Heidelberg
246053228,Privatdozentin Dr. Monica Dunford,229556894,10047,Ruprecht-Karls-Universität Heidelberg
1151243,Professorin Dr. R. Luise Krauth-Siegel,271699,10047,Ruprecht-Karls-Universität Heidelberg
1356440,Dr. Stefan Hillmer,5360884,10047,Ruprecht-Karls-Universität Heidelberg
1251684,Professor Dr. Heiner Schirmer,271699,10047,Ruprecht-Karls-Universität Heidelberg
1114044,Professor Dr. Eduard Christian Hurt,270995,10047,Ruprecht-Karls-Universität Heidelberg
1647109,Dr. Michael Burchard,5183082,10047,Ruprecht-Karls-Universität Heidelberg
211128835,Dr. Dirk Flemming,5424321,10047,Ruprecht-Karls-Universität Heidelberg
1665159,Professor Dr. Hans Harder,39092596,10047,Ruprecht-Karls-Universität Heidelberg
989259,Professor Dr. Hellmut G. Augustin,273595,10047,Ruprecht-Karls-Universität Heidelberg
62645799,Professorin Dr. Judit Árokay,42922943,10047,Ruprecht-Karls-Universität Heidelberg
260445011,"Lázaro Centanin, Ph.D.",260442193,10047,Ruprecht-Karls-Universität Heidelberg
1625432,Professor Dr. Hans-Jörg Himmel,273575,10047,Ruprecht-Karls-Universität Heidelberg
353757739,Dr. Dagmar Schumacher,214631492,10047,Ruprecht-Karls-Universität Heidelberg
1360984,Privatdozent Dr. Norbert Quien,5354755,10047,Ruprecht-Karls-Universität Heidelberg
18263612,Dr. Peter Freytag,18263547,10047,Ruprecht-Karls-Universität Heidelberg
271614432,"Professorin Dr. Loredana Gastaldo, Ph.D.",252537693,10047,Ruprecht-Karls-Universität Heidelberg
1651713,Professor Dr. Joachim Wittbrodt,272617,10047,Ruprecht-Karls-Universität Heidelberg
1116803,Professorin Dr. Margot Isenbeck-Schröter,271503,10047,Ruprecht-Karls-Universität Heidelberg
1087040,Professor Dr.-Ing. Dieter Hänel,5148684,972220,Universität Duisburg-Essen
27051933,Professor Dr. Stefan Rumann,273635,972220,Universität Duisburg-Essen
1063748,Professor Dr. Roland Galle,273249,972220,Universität Duisburg-Essen
1321171,Privatdozent Dr.-Ing. Heinz-Dieter Wend,5292292,972220,Universität Duisburg-Essen
1413849,Professorin Dr. Elke Sumfleth,273635,972220,Universität Duisburg-Essen
1757433,Dr. Thomas Kauffeldt,5148746,972220,Universität Duisburg-Essen
1313227,Professor Dr. Eberhard F. Wassermann,5148752,972220,Universität Duisburg-Essen
1191258,Professor Dr. Rolf Möller,5126288,972220,Universität Duisburg-Essen
1010907,Professorin Dr. Ursula Boos-Nünning,273249,972220,Universität Duisburg-Essen
160053469,Professorin Dr. Amalie Fößel,223828200,972220,Universität Duisburg-Essen
213659701,Professor Dr.-Ing. Andreas Kempf,263348352,972220,Universität Duisburg-Essen
1351708,Professor Dr. Dietrich Wolf,5148732,972220,Universität Duisburg-Essen
1126467,Dr. Hans-Michael Katsch,5398335,972220,Universität Duisburg-Essen
1389645,Professor Dr. Hans Ernst Fischer,273635,972220,Universität Duisburg-Essen
245576190,"Professorin Kristin Surak, Ph.D.",122408594,972220,Universität Duisburg-Essen
1045208,Professor Dr. Peter Entel,271553,972220,Universität Duisburg-Essen
259155,Professor Dr. Justus Cobet,273249,972220,Universität Duisburg-Essen
139253439,Dr. Martin Kammler,5386564,972220,Universität Duisburg-Essen
1722420,Privatdozent Dr. Hartmut Wiggers,5148660,972220,Universität Duisburg-Essen
1335349,Professor Dr.-Ing. Dieter Wünsch,5292286,972220,Universität Duisburg-Essen
1710338,Professor Dr. Heiko Wende,5218950,972220,Universität Duisburg-Essen
46219846,Professor Dr. Stefan Stieglitz,271720050,972220,Universität Duisburg-Essen
315080969,Professor Dr.-Ing. Lucas Davi,259941017,972220,Universität Duisburg-Essen
1204631,Professor Dr.-Ing. Horst Nowack,5101724,972220,Universität Duisburg-Essen
112660345,"Professorin Paola Pozzi, Ph.D.",112660321,972220,Universität Duisburg-Essen
261098,Professor Dr. Tobias Kollmann,272717,972220,Universität Duisburg-Essen
238862939,Professor Dr. Daniel Erni,336556714,972220,Universität Duisburg-Essen
44499614,Professor Dr. Hendrik Streeck,284242792,972220,Universität Duisburg-Essen
218904941,Professor Dr. Christoph Hanck,140514933,972220,Universität Duisburg-Essen
259159,Professor Dr. Siegfried Gehrmann,273249,972220,Universität Duisburg-Essen
1508243,Professor Dr.-Ing. Frank Einar Kruis,5148708,972220,Universität Duisburg-Essen
