person_id,person_name,institution_id,institution_name
80320051,Professor Dr. Kurt Franz,10051,Eberhard Karls Universität Tübingen
35102212,Professorin Dr. Ghazaleh Tabatabai,10051,Eberhard Karls Universität Tübingen
1331813,Privatdozentin Dr. Andrea Wizenmann,10051,Eberhard Karls Universität Tübingen
1517861,Professor Dr. Detmar Meurers,10051,Eberhard Karls Universität Tübingen
286513524,Dr. Sven Nahnsen,10051,Eberhard Karls Universität Tübingen
13491255,Professor Dr. Jan Benda,10051,Eberhard Karls Universität Tübingen
1808409,Dr. Siegfried Alberti,10051,Eberhard Karls Universität Tübingen
1080589,Professor Dr. Rainer W. Gülch,10051,Eberhard Karls Universität Tübingen
1418865,Professor Dr. Robert Feil,10051,Eberhard Karls Universität Tübingen
1435327,Professor Dr. Cornelius Schwarz,10051,Eberhard Karls Universität Tübingen
324918262,"Dr. Thomas Wallis, Ph.D.",10051,Eberhard Karls Universität Tübingen
225950491,Professor Dr. Michael Lämmerhofer,10051,Eberhard Karls Universität Tübingen
231402859,Professor Dr. Markus Janczyk,10051,Eberhard Karls Universität Tübingen
48943314,Dr. Andrea A. Gust,10051,Eberhard Karls Universität Tübingen
1138083,Professor Dr. Joachim Knape,10051,Eberhard Karls Universität Tübingen
1429834,Professor Dr. Manfred Stadler,10051,Eberhard Karls Universität Tübingen
12631256,Professor Dr. Christoph Schwöbel,10051,Eberhard Karls Universität Tübingen
1344716,Professor Dr. Ralf-Peter Jansen,10051,Eberhard Karls Universität Tübingen
1381932,Professor Dr. Rupert Handgretinger,10051,Eberhard Karls Universität Tübingen
1216021,Professor Dr. Peter Pfälzner,10051,Eberhard Karls Universität Tübingen
385461145,Privatdozentin Dr. Ruth Conrad,10051,Eberhard Karls Universität Tübingen
1433248,Professor Dr. Hartmut Leuthold,10051,Eberhard Karls Universität Tübingen
170009913,Professor Dr. Christoph Bohle,10051,Eberhard Karls Universität Tübingen
25556226,Professor Dr. Matthias Bethge,10051,Eberhard Karls Universität Tübingen
1593267,Professor Dr. Reiner Schätzle,10051,Eberhard Karls Universität Tübingen
278600079,Dr. Jeanne Feaux de la Croix,10051,Eberhard Karls Universität Tübingen
1547224,Professor Dr. David Wharam,10051,Eberhard Karls Universität Tübingen
14866179,Privatdozent Dr. Hannes Schmidt,10051,Eberhard Karls Universität Tübingen
195111969,Professorin Dr. Jennifer Christina Ewald,10051,Eberhard Karls Universität Tübingen
1055302,Professor Dr. Horst Förster,10051,Eberhard Karls Universität Tübingen
1380660,Professor Dr. Hans-Peter Fiedler,10051,Eberhard Karls Universität Tübingen
271902801,Professor Dr. Thomas Thiemeyer,10051,Eberhard Karls Universität Tübingen
78131111,"Dr. Ann-Christine Ehlis, Ph.D.",10051,Eberhard Karls Universität Tübingen
5653,Professor Dr. Christoph Hemleben,10051,Eberhard Karls Universität Tübingen
142439824,Dr. Ludger Große-Hovest,10051,Eberhard Karls Universität Tübingen
230270716,Dr. Harald Neidhardt,10051,Eberhard Karls Universität Tübingen
1467953,Professor Dr. Jörg Baten,10051,Eberhard Karls Universität Tübingen
49946742,Professor Dr. Sebastian Thies,10051,Eberhard Karls Universität Tübingen
1190384,Professorin Dr. Maria Moog-Grünewald,10051,Eberhard Karls Universität Tübingen
5877,Professor Dr. Dieter Langewiesche,10051,Eberhard Karls Universität Tübingen
1696329,Professor Dr. Karl-Heinz Wiesmüller,10051,Eberhard Karls Universität Tübingen
240001169,Professor Dr. Karl-Heinz Stanzel,10051,Eberhard Karls Universität Tübingen
1452712,Professor Dr. Thorsten Nürnberger,10051,Eberhard Karls Universität Tübingen
48902177,Dr. Ute Bertsche,10051,Eberhard Karls Universität Tübingen
239140000,Professor Dr. Jörg Robert,10051,Eberhard Karls Universität Tübingen
278634142,Dr. Annette Grabowsky,10051,Eberhard Karls Universität Tübingen
200679658,"Privatdozentin Dr. Efthimia Stegmann, Ph.D.",10051,Eberhard Karls Universität Tübingen
1791275,Professor Dr. Douglas Tweed,10051,Eberhard Karls Universität Tübingen
51831488,Professor Dr. Kostas Kokkotas,10051,Eberhard Karls Universität Tübingen
1055994,Professor Dr. Karl Forchhammer,10051,Eberhard Karls Universität Tübingen
198774740,Privatdozentin Dr. Angelika Zirker,10051,Eberhard Karls Universität Tübingen
1382966,Professor Dr. Helmut Kaul,10051,Eberhard Karls Universität Tübingen
1676305,Professor Dr. Robert Horres,10051,Eberhard Karls Universität Tübingen
1828773,Privatdozent Dr. Hans Joachim Schöpe,10051,Eberhard Karls Universität Tübingen
1154605,Professor Dr. Kristian Kühl,10051,Eberhard Karls Universität Tübingen
1045555,Professorin Dr. Eve-Marie Engels,10051,Eberhard Karls Universität Tübingen
1022192,Professor Dr. Klaus Butzenberger,10051,Eberhard Karls Universität Tübingen
62194785,Professorin Dr. Monika Fleischer,10051,Eberhard Karls Universität Tübingen
145880317,Privatdozentin Dr. Karin Schilbach-Stückle,10051,Eberhard Karls Universität Tübingen
1638661,Professor Dr. Tilman Berger,10051,Eberhard Karls Universität Tübingen
384869579,Dr. Daniel de Kok,10051,Eberhard Karls Universität Tübingen
241354525,Professor Dr. Samuel Featherston,10051,Eberhard Karls Universität Tübingen
1334593,Professor Dr. Wolfgang Wohlleben,10051,Eberhard Karls Universität Tübingen
1040170,Professor Dr. Michael Eckert,10051,Eberhard Karls Universität Tübingen
48943989,Professorin Dr. Wiltrud Mihatsch,10051,Eberhard Karls Universität Tübingen
280301342,"Dr.-Ing. Chuanhe Lu, Ph.D.",10051,Eberhard Karls Universität Tübingen
5202,Professor Dr. Dietrich Beyrau,10051,Eberhard Karls Universität Tübingen
103749518,Professor Dr. Leonard Kaysser,10051,Eberhard Karls Universität Tübingen
1631166,Professor Dr. Volker Leppin,10051,Eberhard Karls Universität Tübingen
311022796,"Professorin Dr. Sara Kleindienst, Ph.D.",10051,Eberhard Karls Universität Tübingen
18612171,Professor Dr. Christian Plewnia,10051,Eberhard Karls Universität Tübingen
1376478,Professor Dr. Horst Tonn,10051,Eberhard Karls Universität Tübingen
256350853,Professorin Dr. Marja Timmermans,10051,Eberhard Karls Universität Tübingen
1609384,Professor Dr. Klaus Gestwa,10051,Eberhard Karls Universität Tübingen
259120013,Professor Dr. Thomas Sattig,10051,Eberhard Karls Universität Tübingen
18552633,Dr. Annette Denzinger,10051,Eberhard Karls Universität Tübingen
103975144,Professor Dr. Boris Nieswand,10051,Eberhard Karls Universität Tübingen
29140823,Professor Dr. Georg Felix,10051,Eberhard Karls Universität Tübingen
1650284,Privatdozentin Dr. Brigitte Gückel,10051,Eberhard Karls Universität Tübingen
1195192,Professor Dr. Herbert Müther,10051,Eberhard Karls Universität Tübingen
203015439,Professor Dr. Matthias Hein,10051,Eberhard Karls Universität Tübingen
241354320,Dr. Oliver Bott,10051,Eberhard Karls Universität Tübingen
1095990,Professor Dr. Michael Heidelberger,10051,Eberhard Karls Universität Tübingen
200649907,Dr. Jörg Neuheiser,10051,Eberhard Karls Universität Tübingen
1063271,Professor Dr. Günter Gauglitz,10051,Eberhard Karls Universität Tübingen
208707073,Professor Dr. Benjamin Nagengast,10051,Eberhard Karls Universität Tübingen
47857702,Privatdozent Dr. Frank Essmann,10051,Eberhard Karls Universität Tübingen
327047143,Dr. Julia Fitzgerald,10051,Eberhard Karls Universität Tübingen
6344,Professor Dr. Hans-Ulrich Schnitzler,10051,Eberhard Karls Universität Tübingen
1574334,Dr. Andreas Fuchs,10051,Eberhard Karls Universität Tübingen
1423757,Professorin Dr. Susanne Winkler,10051,Eberhard Karls Universität Tübingen
1718444,Professor Dr. Martin Biewen,10051,Eberhard Karls Universität Tübingen
59348548,Professor Dr. Stefan Stevanovic,10051,Eberhard Karls Universität Tübingen
1024518,Professor Dr. Thomas Chassé,10051,Eberhard Karls Universität Tübingen
62277150,Professor Dr. Manfred Hallschmid,10051,Eberhard Karls Universität Tübingen
828482,Professor Dr. Josef Jochum,10051,Eberhard Karls Universität Tübingen
1190537,Professor Dr. Uwe Mönnich,10051,Eberhard Karls Universität Tübingen
1122802,Professor Dr. Gundram Jung,10051,Eberhard Karls Universität Tübingen
271889454,Professor Dr. Markus Thomé,10051,Eberhard Karls Universität Tübingen
172395900,Professor Dr. Mahmoud Toulany,10051,Eberhard Karls Universität Tübingen
240854501,Dr. Karsten Rauss,10051,Eberhard Karls Universität Tübingen
1263753,Professor Dr. Friedrich Schöffl,10051,Eberhard Karls Universität Tübingen
1677471,Professor Dr. Andreas Peschel,10051,Eberhard Karls Universität Tübingen
1435631,Professor Dr. Jochen Raecke,10051,Eberhard Karls Universität Tübingen
142993099,Professorin Dr. Barbara Jäger,10051,Eberhard Karls Universität Tübingen
119255494,Professor Dr. Hans-Christoph Nuerk,10051,Eberhard Karls Universität Tübingen
1703565,Privatdozent Dr. Roland Speith,10051,Eberhard Karls Universität Tübingen
5644,Professorin Dr. Vera Hemleben,10051,Eberhard Karls Universität Tübingen
278741704,Dr. Henning Tümmers,10051,Eberhard Karls Universität Tübingen
260005,Professor Dr. Martin Nettesheim,10051,Eberhard Karls Universität Tübingen
1368386,Professor Dr. Harald Floss,10051,Eberhard Karls Universität Tübingen
1452254,Professor Dr. Nils Schopohl,10051,Eberhard Karls Universität Tübingen
1128810,Professor Dr. Hans-Georg Kemper,10051,Eberhard Karls Universität Tübingen
256772248,Professorin Dr. Monique Scheer,10051,Eberhard Karls Universität Tübingen
1380162,Professor Dr. Hans Bernhard Drubig,10051,Eberhard Karls Universität Tübingen
61457953,Professor Dr. Martin Walter,10051,Eberhard Karls Universität Tübingen
252773,Professor Dr. Jürgen Schröder,10051,Eberhard Karls Universität Tübingen
184977191,Professorin Dr. Alexandra Kirsch,10051,Eberhard Karls Universität Tübingen
1505613,Professor Dr. Wilhelm Kohler,10051,Eberhard Karls Universität Tübingen
1002572,Professor Dr. Niels Birbaumer,10051,Eberhard Karls Universität Tübingen
1826511,Professor Dr. Martin Oettel,10051,Eberhard Karls Universität Tübingen
1086026,Professor Dr. Klaus Hantke,10051,Eberhard Karls Universität Tübingen
1581704,Professorin Dr. Sigrid Hirbodian,10051,Eberhard Karls Universität Tübingen
1631261,Dr. Burkhard Fleckenstein,10051,Eberhard Karls Universität Tübingen
278586005,Dr. Virginia Herrmann,10051,Eberhard Karls Universität Tübingen
246061869,Professor Dr. Jochen von Bernstorff,10051,Eberhard Karls Universität Tübingen
190223535,Professor Dr. Thomas Judd,10051,Eberhard Karls Universität Tübingen
1844996,Dr. Mohameden Ould Ahmedou,10051,Eberhard Karls Universität Tübingen
397989477,Dr. Katharina Markmann,10051,Eberhard Karls Universität Tübingen
1200968,Professor Dr. Werner Neus,10051,Eberhard Karls Universität Tübingen
210366998,Professor Dr. Johannes Lipps,10051,Eberhard Karls Universität Tübingen
1104692,Professor Dr. Erhard W. Hinrichs,10051,Eberhard Karls Universität Tübingen
1582735,Professor Dr. Wolfgang Sternefeld,10051,Eberhard Karls Universität Tübingen
1378645,Professorin Dr. Renate Arnold,10426,Charité - Universitätsmedizin Berlin
1537245,Professor Dr. Christoph Stein,10426,Charité - Universitätsmedizin Berlin
82391377,Professorin Dr. Antje Beling,10426,Charité - Universitätsmedizin Berlin
259632729,Dr. Sahar Aly,10426,Charité - Universitätsmedizin Berlin
1058858,Professor Dr. Michael Fromm,10426,Charité - Universitätsmedizin Berlin
254075,Professor Dr. Stefan Brandt,10426,Charité - Universitätsmedizin Berlin
29918345,Dr. Thomas Kammertoens,10426,Charité - Universitätsmedizin Berlin
1568696,Dr. Thomas Pohl,10426,Charité - Universitätsmedizin Berlin
253191,Privatdozent Dr. W. Müller,10426,Charité - Universitätsmedizin Berlin
1568570,Professor Dr. Mathias Strowski,10426,Charité - Universitätsmedizin Berlin
1478686,Professor Dr. Jens P. Dreier,10426,Charité - Universitätsmedizin Berlin
1723002,Professor Dr. Henrik Walter,10426,Charité - Universitätsmedizin Berlin
37843193,Professorin Dr. Petra Seemann,10426,Charité - Universitätsmedizin Berlin
1721074,Privatdozent Dr. Dirk Böhmer,10426,Charité - Universitätsmedizin Berlin
1427399,Dr. Johannes Sebastian Braun,10426,Charité - Universitätsmedizin Berlin
261044,Dr. Christian Warnecke,10426,Charité - Universitätsmedizin Berlin
1142663,Professor Dr. Josef Köhrle,10426,Charité - Universitätsmedizin Berlin
1151526,Professor Dr. Detlev H. Krüger,10426,Charité - Universitätsmedizin Berlin
1408817,Professor Dr. Gabriel Curio,10426,Charité - Universitätsmedizin Berlin
37986400,Dr. Hanna Schell,10426,Charité - Universitätsmedizin Berlin
1672686,Dr. Carsten Grötzinger,10426,Charité - Universitätsmedizin Berlin
1028328,Professorin Dr. Heidi Danker-Hopfe,10426,Charité - Universitätsmedizin Berlin
1381453,Professorin Dr. Rosemarie Grantyn,10426,Charité - Universitätsmedizin Berlin
1843903,Dr. Michel Noutsias,10426,Charité - Universitätsmedizin Berlin
275564495,"Dr. Antigoni Triantafyllopoulou, Ph.D.",10426,Charité - Universitätsmedizin Berlin
14883990,Dr. Birgit Uhlenberg,10426,Charité - Universitätsmedizin Berlin
1464096,Professorin Dr. Isabella Heuser,10426,Charité - Universitätsmedizin Berlin
1524080,Privatdozent Dr. Hans-Dieter Orzechowski,10426,Charité - Universitätsmedizin Berlin
1423542,Professor Dr. Hermann Lage,10426,Charité - Universitätsmedizin Berlin
1461086,Dr. Barbara Uchanska-Ziegler,10426,Charité - Universitätsmedizin Berlin
209504915,Professorin Dr. Sarah A. Shoichet,10426,Charité - Universitätsmedizin Berlin
141763937,Dr. Geert Michel,10426,Charité - Universitätsmedizin Berlin
35532437,Professor Dr. Malek Bajbouj,10426,Charité - Universitätsmedizin Berlin
1108143,Professor Dr. Klaus Peter Hofmann,10426,Charité - Universitätsmedizin Berlin
1570400,Professorin Dr. Petra Gastmeier,10426,Charité - Universitätsmedizin Berlin
1672740,Dr. Horst Dürkhop,10426,Charité - Universitätsmedizin Berlin
1427807,Dr. Ioannis Anagnostopoulos,10426,Charité - Universitätsmedizin Berlin
99841019,Professor Dr. Andreas Hocke,10426,Charité - Universitätsmedizin Berlin
254097,Professor Dr. Andreas Lüschow,10426,Charité - Universitätsmedizin Berlin
1455656,Professor Dr. Stephan A. Loening,10426,Charité - Universitätsmedizin Berlin
1269384,Professor Dr. Heinz-Peter Schultheiss,10426,Charité - Universitätsmedizin Berlin
1779936,Professor Dr. Victor Tarabykin,10426,Charité - Universitätsmedizin Berlin
257865,Dr. Alfred Gitter,10426,Charité - Universitätsmedizin Berlin
1299545,Professor Dr. Eckhard Thiel,10426,Charité - Universitätsmedizin Berlin
1380107,Professor Dr. Bernd Dörken,10426,Charité - Universitätsmedizin Berlin
415088,Professorin Dr. Duska Dragun,10426,Charité - Universitätsmedizin Berlin
26210477,"Jens Geginat, Ph.D.",10426,Charité - Universitätsmedizin Berlin
1376913,Professorin Dr. Carmen Scheibenbogen,10426,Charité - Universitätsmedizin Berlin
14086322,Professor Dr. Martin Witzenrath,10426,Charité - Universitätsmedizin Berlin
152147257,Professorin Dr. Britta Eickholt,10426,Charité - Universitätsmedizin Berlin
1386192,Professor Dr. Reinhold Schäfer,10426,Charité - Universitätsmedizin Berlin
63587369,Professorin Dr. Seija Lehnardt,10426,Charité - Universitätsmedizin Berlin
259627294,Dr. Catherine Chaput,10426,Charité - Universitätsmedizin Berlin
186192741,Dr. Patrick Scheerer,10426,Charité - Universitätsmedizin Berlin
1622071,Privatdozent Dr. Markus M. Heimesaat,10426,Charité - Universitätsmedizin Berlin
16523205,Privatdozent Dr. Joachim Janowski,10426,Charité - Universitätsmedizin Berlin
22545187,Professor Dr. Christian M. T. Spahn,10426,Charité - Universitätsmedizin Berlin
1271715,Professor Dr. Ralf Reiner Schumann,10426,Charité - Universitätsmedizin Berlin
253189,Professor Dr. W.R. Lanksch,10426,Charité - Universitätsmedizin Berlin
1548988,Dr. Gerhard Wolff,10426,Charité - Universitätsmedizin Berlin
1032347,Professor Dr. Manfred Dietel,10426,Charité - Universitätsmedizin Berlin
1136460,Dr. Christiane Kleuß,10426,Charité - Universitätsmedizin Berlin
1397487,Privatdozent Dr. Christian Woiciechowsky,10426,Charité - Universitätsmedizin Berlin
1101773,Professor Dr. Hanspeter Herzel,10426,Charité - Universitätsmedizin Berlin
1160784,Professor Dr.-Ing. Jürgen Lademann,10426,Charité - Universitätsmedizin Berlin
1280417,Professor Dr. Pranav Sinha,10426,Charité - Universitätsmedizin Berlin
1011842,Professorin Dr. Elke Bogner,10426,Charité - Universitätsmedizin Berlin
1568686,Dr. Michael Notter,10426,Charité - Universitätsmedizin Berlin
225955979,Dr. Dominik Seelow,10426,Charité - Universitätsmedizin Berlin
1334983,Professor Dr. Paul Wrede,10426,Charité - Universitätsmedizin Berlin
1228860,Professor Dr. Werner Reutter,10426,Charité - Universitätsmedizin Berlin
1591226,Dr. Serdar Deger,10426,Charité - Universitätsmedizin Berlin
223309510,Dr. Mehmet Gövercin,10426,Charité - Universitätsmedizin Berlin
1726277,Dr. Rudolf Volkmer,10426,Charité - Universitätsmedizin Berlin
1028342,Professor Dr. Peter T. Daniel,10426,Charité - Universitätsmedizin Berlin
1590729,Professor Dr. Dietmar Schmitz,10426,Charité - Universitätsmedizin Berlin
178239890,Dr. Dje Philippe N´Guessan,10426,Charité - Universitätsmedizin Berlin
1782407,Dr. Christian Meisel,10426,Charité - Universitätsmedizin Berlin
6382,Professor Dr. Günter Schultz,10426,Charité - Universitätsmedizin Berlin
254181,Professorin Dr. Kersten Villringer,10426,Charité - Universitätsmedizin Berlin
1790765,"Professorin Dr. Katja Kotsch, Ph.D.",10426,Charité - Universitätsmedizin Berlin
254083,Dr. Hellmut Obrig,10426,Charité - Universitätsmedizin Berlin
59327745,Professor Dr. Max Löhning,10426,Charité - Universitätsmedizin Berlin
1609679,Professor Dr. Michael Schäfer,10426,Charité - Universitätsmedizin Berlin
84129100,Dr. Richard Kovács,10426,Charité - Universitätsmedizin Berlin
1381175,Dr. Reinhard Geßner,10426,Charité - Universitätsmedizin Berlin
1328585,Professor Dr. Bertram Wiedenmann,10426,Charité - Universitätsmedizin Berlin
254195,Dr. Paul Wrede,10426,Charité - Universitätsmedizin Berlin
83350982,Privatdozentin Dr. Caroline Schmidt-Lucke,10426,Charité - Universitätsmedizin Berlin
1632574,Professor Dr. Gerald Willimsky,10426,Charité - Universitätsmedizin Berlin
1308888,Privatdozent Dr. Roland Vetter,10426,Charité - Universitätsmedizin Berlin
1462953,Privatdozentin Dr. Claudia Eder,10426,Charité - Universitätsmedizin Berlin
30964304,Professorin Dr. Ulrike Blume-Peytavi,10426,Charité - Universitätsmedizin Berlin
1865831,Professorin Dr. Birgit Sawitzki,10426,Charité - Universitätsmedizin Berlin
1452567,Professor Dr. Andreas Meisel,10426,Charité - Universitätsmedizin Berlin
1865841,Dr. Hartmut Radtke,10426,Charité - Universitätsmedizin Berlin
1197031,Professorin Dr. Ursula Müller-Werdan,10426,Charité - Universitätsmedizin Berlin
1050599,Professor Dr. Roland Felix,10426,Charité - Universitätsmedizin Berlin
278833011,Dr. Thi Minh Tam Ta,10426,Charité - Universitätsmedizin Berlin
1439612,Professor Dr. Peter Marx,10426,Charité - Universitätsmedizin Berlin
1325189,Professor Dr. Martin Welte,10426,Charité - Universitätsmedizin Berlin
1042818,Professor Dr. Karl M. Einhäupl,10426,Charité - Universitätsmedizin Berlin
1801234,Dr. Hans-Christian Kornau,10426,Charité - Universitätsmedizin Berlin
25064097,Tobias Jung,10426,Charité - Universitätsmedizin Berlin
1111439,Professor Dr. Wolfgang Höhne,10426,Charité - Universitätsmedizin Berlin
1300969,Professor Dr. Franz Theuring,10426,Charité - Universitätsmedizin Berlin
1448268,Professor Dr. Christoph Johannes Ploner,10426,Charité - Universitätsmedizin Berlin
49906076,Dr. Jochen Maul,10426,Charité - Universitätsmedizin Berlin
259665719,Dr. Holger Müller-Redetzky,10426,Charité - Universitätsmedizin Berlin
1441767,Dr. Armin Volz,10426,Charité - Universitätsmedizin Berlin
1408390,Professor Dr. Falk Hiepe,10426,Charité - Universitätsmedizin Berlin
1844025,Dr. Uwe Kühl,10426,Charité - Universitätsmedizin Berlin
415109,Professorin Dr. Patricia Ruiz Noppinger,10426,Charité - Universitätsmedizin Berlin
1816378,Professor Dr. Joachim Spranger,10426,Charité - Universitätsmedizin Berlin
1423146,Professor Dr. Tengis Gloveli,10426,Charité - Universitätsmedizin Berlin
14068077,Professorin Dr. Andrea Kühn,10426,Charité - Universitätsmedizin Berlin
1598956,Privatdozent Dr. Thomas Meyer,10426,Charité - Universitätsmedizin Berlin
1840094,Professor Dr. Imre Vida,10426,Charité - Universitätsmedizin Berlin
1415073,Professor Dr. Joachim Sieper,10426,Charité - Universitätsmedizin Berlin
1636644,Professorin Dr. Dietlind Zohlnhöfer-Momm,10426,Charité - Universitätsmedizin Berlin
1206972,Professor Dr. Thomas Georg Ohm,10426,Charité - Universitätsmedizin Berlin
1182636,Professor Dr.-Ing. Harald Meinhold,10426,Charité - Universitätsmedizin Berlin
999511,Professor Dr. Jean-Pierre Bernimoulin,10426,Charité - Universitätsmedizin Berlin
422390,Professor Dr. Friedel M. Reischies,10426,Charité - Universitätsmedizin Berlin
59143561,Dr. Jan Schmoranzer,10426,Charité - Universitätsmedizin Berlin
1115202,Professor Dr. Michael Hummel,10426,Charité - Universitätsmedizin Berlin
1278440,Professorin Dr. Christine Sers,10426,Charité - Universitätsmedizin Berlin
85931210,Privatdozentin Dr. Carmen Infante Duarte,10426,Charité - Universitätsmedizin Berlin
1033408,Professor Dr. Ulrich Dirnagl,10426,Charité - Universitätsmedizin Berlin
1749282,Dr. Stefan Bläß,10426,Charité - Universitätsmedizin Berlin
1270047,Professor Dr. Jörg-Dieter Schulzke,10426,Charité - Universitätsmedizin Berlin
1791805,Professor Dr. Franz-Josef Bartl,10426,Charité - Universitätsmedizin Berlin
1460874,Professor Dr. Joachim Behr,10426,Charité - Universitätsmedizin Berlin
284039481,Dr. Francisco Fernández-Klett,10426,Charité - Universitätsmedizin Berlin
32645370,Professor Dr. John-Dylan Haynes,10426,Charité - Universitätsmedizin Berlin
277737926,Dr. Janine Zahlten,10426,Charité - Universitätsmedizin Berlin
111267551,Dr. Sebastian Schuchmann,10426,Charité - Universitätsmedizin Berlin
233640436,Dr. Felicitas Escher,10426,Charité - Universitätsmedizin Berlin
233297459,Dr. Chotima Böttcher,10426,Charité - Universitätsmedizin Berlin
1671779,Professor Dr. Fabian Klostermann,10426,Charité - Universitätsmedizin Berlin
257863,Dr. Michal Hua Fan,10426,Charité - Universitätsmedizin Berlin
1524655,"Professor Dr. Andreas Patzak, Ph.D.",10426,Charité - Universitätsmedizin Berlin
1098780,Professorin Dr. Regine Heilbronn,10426,Charité - Universitätsmedizin Berlin
827443,Professor Dr. Christian Strasburger,10426,Charité - Universitätsmedizin Berlin
1101976,Professor Dr. Volker Hess,10426,Charité - Universitätsmedizin Berlin
1385937,Professor Dr. Hanno Riess,10426,Charité - Universitätsmedizin Berlin
1767477,Professor Dr. Thomas Fischer,10426,Charité - Universitätsmedizin Berlin
192458465,Dr. Jochen Hecht,10426,Charité - Universitätsmedizin Berlin
214598287,Dr. Dido Lenze,10426,Charité - Universitätsmedizin Berlin
1214015,Professor Dr. Pontus Börje Persson,10426,Charité - Universitätsmedizin Berlin
1388619,Professor Dr. Peter Wust,10426,Charité - Universitätsmedizin Berlin
1340036,Professor Dr. Andreas Ziegler,10426,Charité - Universitätsmedizin Berlin
1817271,Professor Dr. Lutz Schomburg,10426,Charité - Universitätsmedizin Berlin
1642576,Professor Dr. Ulrich Kintscher,10426,Charité - Universitätsmedizin Berlin
1853664,Dr. Tom Schilling,10426,Charité - Universitätsmedizin Berlin
49905937,Dr. Verena Moos,10426,Charité - Universitätsmedizin Berlin
234419161,Dr. Tobias Alexander,10426,Charité - Universitätsmedizin Berlin
193336373,Professorin Dr. Il-Kang Na,10426,Charité - Universitätsmedizin Berlin
1872077,Professor Dr. Winfried Brenner,10426,Charité - Universitätsmedizin Berlin
1758380,Dr. Christian Geier,10426,Charité - Universitätsmedizin Berlin
1379655,Professor Dr. Volker Budach,10426,Charité - Universitätsmedizin Berlin
1852099,Privatdozent Dr. Robert Preissner,10426,Charité - Universitätsmedizin Berlin
1088687,Professor Dr. Christian Hagemeier,10426,Charité - Universitätsmedizin Berlin
1853432,Dr. Sven Müller-Röver,10426,Charité - Universitätsmedizin Berlin
1738366,Professor Dr. Jörg Geiger,10426,Charité - Universitätsmedizin Berlin
31600611,Professorin Dr. Martina Meinke,10426,Charité - Universitätsmedizin Berlin
243115836,Dr. Helena Radbruch,10426,Charité - Universitätsmedizin Berlin
1586677,"Professor Dr. Wolfgang Kübler, Ph.D.",10426,Charité - Universitätsmedizin Berlin
1038624,Professor Dr. Rainer Duchmann,10426,Charité - Universitätsmedizin Berlin
1311996,Professor Dr. Hans-Dieter Volk,10426,Charité - Universitätsmedizin Berlin
234417172,Dr. Guido Heine,10426,Charité - Universitätsmedizin Berlin
257883,Dr. Katharina Detjen,10426,Charité - Universitätsmedizin Berlin
16216148,Professor Dr. M. Schönfelder,10426,Charité - Universitätsmedizin Berlin
1425638,Dr. Martin Heck,10426,Charité - Universitätsmedizin Berlin
1334845,Professorin Dr. Margitta Worm,10426,Charité - Universitätsmedizin Berlin
257877,Privatdozent Dr. Stefan Rosewitz,10426,Charité - Universitätsmedizin Berlin
254336895,Dr. Till Althoff,10426,Charité - Universitätsmedizin Berlin
1418409,Professorin Dr. Petra Reinke,10426,Charité - Universitätsmedizin Berlin
29918913,"Professorin Dr. Chiara Romagnani, Ph.D.",10426,Charité - Universitätsmedizin Berlin
1236852,Professor Dr. Hans Rommelspacher,10426,Charité - Universitätsmedizin Berlin
1433438,Professor Dr. Heiko Krude,10426,Charité - Universitätsmedizin Berlin
194175204,Privatdozentin Dr. Anja A. Kühl,10426,Charité - Universitätsmedizin Berlin
139284331,Professor Dr. Nils Blüthgen,10426,Charité - Universitätsmedizin Berlin
1020401,Professor Dr. Gerd-Rüdiger Burmester,10426,Charité - Universitätsmedizin Berlin
