person_id,person_name,project_id_number,institution_id,institution_name
256350853,Professorin Dr. Marja Timmermans,323250248,10051,Eberhard Karls Universität Tübingen
1609384,Professor Dr. Klaus Gestwa,5167706,10051,Eberhard Karls Universität Tübingen
259120013,Professor Dr. Thomas Sattig,198647426,10051,Eberhard Karls Universität Tübingen
18552633,Dr. Annette Denzinger,5232102,10051,Eberhard Karls Universität Tübingen
103975144,Professor Dr. Boris Nieswand,278600879,10051,Eberhard Karls Universität Tübingen
29140823,Professor Dr. Georg Felix,29140807,10051,Eberhard Karls Universität Tübingen
1650284,Privatdozentin Dr. Brigitte Gückel,273479,10051,Eberhard Karls Universität Tübingen
1195192,Professor Dr. Herbert Müther,5280646,10051,Eberhard Karls Universität Tübingen
203015439,Professor Dr. Matthias Hein,39134088,10051,Eberhard Karls Universität Tübingen
241354320,Dr. Oliver Bott,144959379,10051,Eberhard Karls Universität Tübingen
1095990,Professor Dr. Michael Heidelberger,273615,10051,Eberhard Karls Universität Tübingen
200649907,Dr. Jörg Neuheiser,200649846,10051,Eberhard Karls Universität Tübingen
1063271,Professor Dr. Günter Gauglitz,268879,10051,Eberhard Karls Universität Tübingen
208707073,Professor Dr. Benjamin Nagengast,194491240,10051,Eberhard Karls Universität Tübingen
47857702,Privatdozent Dr. Frank Essmann,80995657,10051,Eberhard Karls Universität Tübingen
327047143,Dr. Julia Fitzgerald,327043846,10051,Eberhard Karls Universität Tübingen
6344,Professor Dr. Hans-Ulrich Schnitzler,273435,10051,Eberhard Karls Universität Tübingen
1574334,Dr. Andreas Fuchs,240000619,10051,Eberhard Karls Universität Tübingen
1423757,Professorin Dr. Susanne Winkler,5364918,10051,Eberhard Karls Universität Tübingen
1718444,Professor Dr. Martin Biewen,194491240,10051,Eberhard Karls Universität Tübingen
59348548,Professor Dr. Stefan Stevanovic,273479,10051,Eberhard Karls Universität Tübingen
1024518,Professor Dr. Thomas Chassé,270225,10051,Eberhard Karls Universität Tübingen
62277150,Professor Dr. Manfred Hallschmid,5455590,10051,Eberhard Karls Universität Tübingen
828482,Professor Dr. Josef Jochum,273235,10051,Eberhard Karls Universität Tübingen
1190537,Professor Dr. Uwe Mönnich,5167731,10051,Eberhard Karls Universität Tübingen
1122802,Professor Dr. Gundram Jung,5268834,10051,Eberhard Karls Universität Tübingen
271889454,Professor Dr. Markus Thomé,162347376,10051,Eberhard Karls Universität Tübingen
172395900,Professor Dr. Mahmoud Toulany,12447501,10051,Eberhard Karls Universität Tübingen
240854501,Dr. Karsten Rauss,240854439,10051,Eberhard Karls Universität Tübingen
1263753,Professor Dr. Friedrich Schöffl,5387067,10051,Eberhard Karls Universität Tübingen
1677471,Professor Dr. Andreas Peschel,273241,10051,Eberhard Karls Universität Tübingen
1435631,Professor Dr. Jochen Raecke,5167800,10051,Eberhard Karls Universität Tübingen
142993099,Professorin Dr. Barbara Jäger,795914,10051,Eberhard Karls Universität Tübingen
119255494,Professor Dr. Hans-Christoph Nuerk,194491240,10051,Eberhard Karls Universität Tübingen
1703565,Privatdozent Dr. Roland Speith,5280678,10051,Eberhard Karls Universität Tübingen
5644,Professorin Dr. Vera Hemleben,5082120,10051,Eberhard Karls Universität Tübingen
278741704,Dr. Henning Tümmers,278741563,10051,Eberhard Karls Universität Tübingen
260005,Professor Dr. Martin Nettesheim,273615,10051,Eberhard Karls Universität Tübingen
1368386,Professor Dr. Harald Floss,239999270,10051,Eberhard Karls Universität Tübingen
1452254,Professor Dr. Nils Schopohl,5338552,10051,Eberhard Karls Universität Tübingen
1128810,Professor Dr. Hans-Georg Kemper,271625,10051,Eberhard Karls Universität Tübingen
256772248,Professorin Dr. Monique Scheer,278648804,10051,Eberhard Karls Universität Tübingen
1380162,Professor Dr. Hans Bernhard Drubig,5167756,10051,Eberhard Karls Universität Tübingen
61457953,Professor Dr. Martin Walter,63833934,10051,Eberhard Karls Universität Tübingen
252773,Professor Dr. Jürgen Schröder,271625,10051,Eberhard Karls Universität Tübingen
184977191,Professorin Dr. Alexandra Kirsch,25268764,10051,Eberhard Karls Universität Tübingen
1505613,Professor Dr. Wilhelm Kohler,272863,10051,Eberhard Karls Universität Tübingen
1002572,Professor Dr. Niels Birbaumer,273435,10051,Eberhard Karls Universität Tübingen
1826511,Professor Dr. Martin Oettel,21604262,10051,Eberhard Karls Universität Tübingen
1086026,Professor Dr. Klaus Hantke,273241,10051,Eberhard Karls Universität Tübingen
1581704,Professorin Dr. Sigrid Hirbodian,114462473,10051,Eberhard Karls Universität Tübingen
1631261,Dr. Burkhard Fleckenstein,5269228,10051,Eberhard Karls Universität Tübingen
278586005,Dr. Virginia Herrmann,239999133,10051,Eberhard Karls Universität Tübingen
246061869,Professor Dr. Jochen von Bernstorff,278651695,10051,Eberhard Karls Universität Tübingen
190223535,Professor Dr. Thomas Judd,190223411,10051,Eberhard Karls Universität Tübingen
1844996,Dr. Mohameden Ould Ahmedou,112762558,10051,Eberhard Karls Universität Tübingen
397989477,Dr. Katharina Markmann,397989051,10051,Eberhard Karls Universität Tübingen
1200968,Professor Dr. Werner Neus,272863,10051,Eberhard Karls Universität Tübingen
210366998,Professor Dr. Johannes Lipps,239999872,10051,Eberhard Karls Universität Tübingen
1104692,Professor Dr. Erhard W. Hinrichs,5167718,10051,Eberhard Karls Universität Tübingen
1582735,Professor Dr. Wolfgang Sternefeld,5167744,10051,Eberhard Karls Universität Tübingen
1378645,Professorin Dr. Renate Arnold,5449312,10426,Charité - Universitätsmedizin Berlin
1537245,Professor Dr. Christoph Stein,968539,10426,Charité - Universitätsmedizin Berlin
82391377,Professorin Dr. Antje Beling,5437447,10426,Charité - Universitätsmedizin Berlin
259632729,Dr. Sahar Aly,178237475,10426,Charité - Universitätsmedizin Berlin
1058858,Professor Dr. Michael Fromm,271543,10426,Charité - Universitätsmedizin Berlin
254075,Professor Dr. Stefan Brandt,272293,10426,Charité - Universitätsmedizin Berlin
29918345,Dr. Thomas Kammertoens,29918329,10426,Charité - Universitätsmedizin Berlin
1568696,Dr. Thomas Pohl,5271132,10426,Charité - Universitätsmedizin Berlin
253191,Privatdozent Dr. W. Müller,271095,10426,Charité - Universitätsmedizin Berlin
1568570,Professor Dr. Mathias Strowski,823482,10426,Charité - Universitätsmedizin Berlin
1478686,Professor Dr. Jens P. Dreier,5360343,10426,Charité - Universitätsmedizin Berlin
1723002,Professor Dr. Henrik Walter,24184485,10426,Charité - Universitätsmedizin Berlin
37843193,Professorin Dr. Petra Seemann,5303388,10426,Charité - Universitätsmedizin Berlin
1721074,Privatdozent Dr. Dirk Böhmer,5092652,10426,Charité - Universitätsmedizin Berlin
1427399,Dr. Johannes Sebastian Braun,5139606,10426,Charité - Universitätsmedizin Berlin
261044,Dr. Christian Warnecke,271543,10426,Charité - Universitätsmedizin Berlin
1142663,Professor Dr. Josef Köhrle,823482,10426,Charité - Universitätsmedizin Berlin
1151526,Professor Dr. Detlev H. Krüger,462190,10426,Charité - Universitätsmedizin Berlin
1408817,Professor Dr. Gabriel Curio,272293,10426,Charité - Universitätsmedizin Berlin
37986400,Dr. Hanna Schell,193285328,10426,Charité - Universitätsmedizin Berlin
1672686,Dr. Carsten Grötzinger,5355348,10426,Charité - Universitätsmedizin Berlin
1028328,Professorin Dr. Heidi Danker-Hopfe,272341,10426,Charité - Universitätsmedizin Berlin
1381453,Professorin Dr. Rosemarie Grantyn,271095,10426,Charité - Universitätsmedizin Berlin
1843903,Dr. Michel Noutsias,5437445,10426,Charité - Universitätsmedizin Berlin
275564495,"Dr. Antigoni Triantafyllopoulou, Ph.D.",275544974,10426,Charité - Universitätsmedizin Berlin
14883990,Dr. Birgit Uhlenberg,14883842,10426,Charité - Universitätsmedizin Berlin
1464096,Professorin Dr. Isabella Heuser,272341,10426,Charité - Universitätsmedizin Berlin
1524080,Privatdozent Dr. Hans-Dieter Orzechowski,5437439,10426,Charité - Universitätsmedizin Berlin
1423542,Professor Dr. Hermann Lage,5092762,10426,Charité - Universitätsmedizin Berlin
1461086,Dr. Barbara Uchanska-Ziegler,5164124,10426,Charité - Universitätsmedizin Berlin
209504915,Professorin Dr. Sarah A. Shoichet,261102178,10426,Charité - Universitätsmedizin Berlin
141763937,Dr. Geert Michel,14884057,10426,Charité - Universitätsmedizin Berlin
35532437,Professor Dr. Malek Bajbouj,39932880,10426,Charité - Universitätsmedizin Berlin
1108143,Professor Dr. Klaus Peter Hofmann,271543,10426,Charité - Universitätsmedizin Berlin
1570400,Professorin Dr. Petra Gastmeier,273193,10426,Charité - Universitätsmedizin Berlin
1672740,Dr. Horst Dürkhop,5355370,10426,Charité - Universitätsmedizin Berlin
1427807,Dr. Ioannis Anagnostopoulos,63567637,10426,Charité - Universitätsmedizin Berlin
99841019,Professor Dr. Andreas Hocke,178713365,10426,Charité - Universitätsmedizin Berlin
254097,Professor Dr. Andreas Lüschow,272293,10426,Charité - Universitätsmedizin Berlin
1455656,Professor Dr. Stephan A. Loening,5092652,10426,Charité - Universitätsmedizin Berlin
1269384,Professor Dr. Heinz-Peter Schultheiss,273587,10426,Charité - Universitätsmedizin Berlin
1779936,Professor Dr. Victor Tarabykin,14884057,10426,Charité - Universitätsmedizin Berlin
257865,Dr. Alfred Gitter,271543,10426,Charité - Universitätsmedizin Berlin
1299545,Professor Dr. Eckhard Thiel,5271126,10426,Charité - Universitätsmedizin Berlin
1380107,Professor Dr. Bernd Dörken,271543,10426,Charité - Universitätsmedizin Berlin
415088,Professorin Dr. Duska Dragun,273389,10426,Charité - Universitätsmedizin Berlin
26210477,"Jens Geginat, Ph.D.",32542203,10426,Charité - Universitätsmedizin Berlin
1376913,Professorin Dr. Carmen Scheibenbogen,5437490,10426,Charité - Universitätsmedizin Berlin
14086322,Professor Dr. Martin Witzenrath,178452533,10426,Charité - Universitätsmedizin Berlin
152147257,Professorin Dr. Britta Eickholt,236584429,10426,Charité - Universitätsmedizin Berlin
1386192,Professor Dr. Reinhold Schäfer,5271028,10426,Charité - Universitätsmedizin Berlin
63587369,Professorin Dr. Seija Lehnardt,63587610,10426,Charité - Universitätsmedizin Berlin
259627294,Dr. Catherine Chaput,259625739,10426,Charité - Universitätsmedizin Berlin
186192741,Dr. Patrick Scheerer,192594593,10426,Charité - Universitätsmedizin Berlin
1622071,Privatdozent Dr. Markus M. Heimesaat,5411205,10426,Charité - Universitätsmedizin Berlin
16523205,Privatdozent Dr. Joachim Janowski,273587,10426,Charité - Universitätsmedizin Berlin
22545187,Professor Dr. Christian M. T. Spahn,25065445,10426,Charité - Universitätsmedizin Berlin
1271715,Professor Dr. Ralf Reiner Schumann,5411120,10426,Charité - Universitätsmedizin Berlin
253189,Professor Dr. W.R. Lanksch,271095,10426,Charité - Universitätsmedizin Berlin
1548988,Dr. Gerhard Wolff,5386913,10426,Charité - Universitätsmedizin Berlin
1032347,Professor Dr. Manfred Dietel,5092762,10426,Charité - Universitätsmedizin Berlin
1136460,Dr. Christiane Kleuß,5225272,10426,Charité - Universitätsmedizin Berlin
1397487,Privatdozent Dr. Christian Woiciechowsky,5139718,10426,Charité - Universitätsmedizin Berlin
1101773,Professor Dr. Hanspeter Herzel,5377251,10426,Charité - Universitätsmedizin Berlin
1160784,Professor Dr.-Ing. Jürgen Lademann,240272867,10426,Charité - Universitätsmedizin Berlin
1280417,Professor Dr. Pranav Sinha,5092762,10426,Charité - Universitätsmedizin Berlin
1011842,Professorin Dr. Elke Bogner,462190,10426,Charité - Universitätsmedizin Berlin
1568686,Dr. Michael Notter,5271126,10426,Charité - Universitätsmedizin Berlin
225955979,Dr. Dominik Seelow,256479157,10426,Charité - Universitätsmedizin Berlin
1334983,Professor Dr. Paul Wrede,165114067,10426,Charité - Universitätsmedizin Berlin
1228860,Professor Dr. Werner Reutter,271543,10426,Charité - Universitätsmedizin Berlin
1591226,Dr. Serdar Deger,5092652,10426,Charité - Universitätsmedizin Berlin
223309510,Dr. Mehmet Gövercin,158230677,10426,Charité - Universitätsmedizin Berlin
1726277,Dr. Rudolf Volkmer,5164174,10426,Charité - Universitätsmedizin Berlin
1028342,Professor Dr. Peter T. Daniel,271543,10426,Charité - Universitätsmedizin Berlin
1590729,Professor Dr. Dietmar Schmitz,462239,10426,Charité - Universitätsmedizin Berlin
178239890,Dr. Dje Philippe N´Guessan,164295104,10426,Charité - Universitätsmedizin Berlin
1782407,Dr. Christian Meisel,5130748,10426,Charité - Universitätsmedizin Berlin
6382,Professor Dr. Günter Schultz,5163954,10426,Charité - Universitätsmedizin Berlin
254181,Professorin Dr. Kersten Villringer,272293,10426,Charité - Universitätsmedizin Berlin
1790765,"Professorin Dr. Katja Kotsch, Ph.D.",5437458,10426,Charité - Universitätsmedizin Berlin
254083,Dr. Hellmut Obrig,272293,10426,Charité - Universitätsmedizin Berlin
59327745,Professor Dr. Max Löhning,462190,10426,Charité - Universitätsmedizin Berlin
1609679,Professor Dr. Michael Schäfer,271543,10426,Charité - Universitätsmedizin Berlin
84129100,Dr. Richard Kovács,84128868,10426,Charité - Universitätsmedizin Berlin
1381175,Dr. Reinhard Geßner,271543,10426,Charité - Universitätsmedizin Berlin
1328585,Professor Dr. Bertram Wiedenmann,271543,10426,Charité - Universitätsmedizin Berlin
254195,Dr. Paul Wrede,270463,10426,Charité - Universitätsmedizin Berlin
83350982,Privatdozentin Dr. Caroline Schmidt-Lucke,83350972,10426,Charité - Universitätsmedizin Berlin
1632574,Professor Dr. Gerald Willimsky,5271104,10426,Charité - Universitätsmedizin Berlin
1308888,Privatdozent Dr. Roland Vetter,5437474,10426,Charité - Universitätsmedizin Berlin
1462953,Privatdozentin Dr. Claudia Eder,271095,10426,Charité - Universitätsmedizin Berlin
30964304,Professorin Dr. Ulrike Blume-Peytavi,240272380,10426,Charité - Universitätsmedizin Berlin
1865831,Professorin Dr. Birgit Sawitzki,5449336,10426,Charité - Universitätsmedizin Berlin
1452567,Professor Dr. Andreas Meisel,5130748,10426,Charité - Universitätsmedizin Berlin
1865841,Dr. Hartmut Radtke,5449340,10426,Charité - Universitätsmedizin Berlin
1197031,Professorin Dr. Ursula Müller-Werdan,5353890,10426,Charité - Universitätsmedizin Berlin
1050599,Professor Dr. Roland Felix,271867,10426,Charité - Universitätsmedizin Berlin
278833011,Dr. Thi Minh Tam Ta,278832784,10426,Charité - Universitätsmedizin Berlin
1439612,Professor Dr. Peter Marx,272293,10426,Charité - Universitätsmedizin Berlin
1325189,Professor Dr. Martin Welte,5139636,10426,Charité - Universitätsmedizin Berlin
1042818,Professor Dr. Karl M. Einhäupl,272293,10426,Charité - Universitätsmedizin Berlin
1801234,Dr. Hans-Christian Kornau,5275978,10426,Charité - Universitätsmedizin Berlin
25064097,Tobias Jung,245619036,10426,Charité - Universitätsmedizin Berlin
1111439,Professor Dr. Wolfgang Höhne,269589,10426,Charité - Universitätsmedizin Berlin
1300969,Professor Dr. Franz Theuring,271543,10426,Charité - Universitätsmedizin Berlin
1448268,Professor Dr. Christoph Johannes Ploner,272293,10426,Charité - Universitätsmedizin Berlin
49906076,Dr. Jochen Maul,49906044,10426,Charité - Universitätsmedizin Berlin
259665719,Dr. Holger Müller-Redetzky,259665229,10426,Charité - Universitätsmedizin Berlin
1441767,Dr. Armin Volz,5164136,10426,Charité - Universitätsmedizin Berlin
1408390,Professor Dr. Falk Hiepe,5130900,10426,Charité - Universitätsmedizin Berlin
1844025,Dr. Uwe Kühl,5437482,10426,Charité - Universitätsmedizin Berlin
415109,Professorin Dr. Patricia Ruiz Noppinger,273389,10426,Charité - Universitätsmedizin Berlin
1816378,Professor Dr. Joachim Spranger,823482,10426,Charité - Universitätsmedizin Berlin
1423146,Professor Dr. Tengis Gloveli,5150133,10426,Charité - Universitätsmedizin Berlin
14068077,Professorin Dr. Andrea Kühn,39052203,10426,Charité - Universitätsmedizin Berlin
1598956,Privatdozent Dr. Thomas Meyer,158230677,10426,Charité - Universitätsmedizin Berlin
1840094,Professor Dr. Imre Vida,5130614,10426,Charité - Universitätsmedizin Berlin
1415073,Professor Dr. Joachim Sieper,5130844,10426,Charité - Universitätsmedizin Berlin
1636644,Professorin Dr. Dietlind Zohlnhöfer-Momm,272399,10426,Charité - Universitätsmedizin Berlin
1206972,Professor Dr. Thomas Georg Ohm,272293,10426,Charité - Universitätsmedizin Berlin
1182636,Professor Dr.-Ing. Harald Meinhold,5213794,10426,Charité - Universitätsmedizin Berlin
999511,Professor Dr. Jean-Pierre Bernimoulin,271825,10426,Charité - Universitätsmedizin Berlin
422390,Professor Dr. Friedel M. Reischies,272341,10426,Charité - Universitätsmedizin Berlin
59143561,Dr. Jan Schmoranzer,202189597,10426,Charité - Universitätsmedizin Berlin
1115202,Professor Dr. Michael Hummel,5271150,10426,Charité - Universitätsmedizin Berlin
1278440,Professorin Dr. Christine Sers,5271028,10426,Charité - Universitätsmedizin Berlin
85931210,Privatdozentin Dr. Carmen Infante Duarte,5449320,10426,Charité - Universitätsmedizin Berlin
1033408,Professor Dr. Ulrich Dirnagl,271095,10426,Charité - Universitätsmedizin Berlin
1749282,Dr. Stefan Bläß,5130936,10426,Charité - Universitätsmedizin Berlin
1270047,Professor Dr. Jörg-Dieter Schulzke,271543,10426,Charité - Universitätsmedizin Berlin
1791805,Professor Dr. Franz-Josef Bartl,5230770,10426,Charité - Universitätsmedizin Berlin
1460874,Professor Dr. Joachim Behr,462239,10426,Charité - Universitätsmedizin Berlin
284039481,Dr. Francisco Fernández-Klett,63670005,10426,Charité - Universitätsmedizin Berlin
32645370,Professor Dr. John-Dylan Haynes,24184485,10426,Charité - Universitätsmedizin Berlin
277737926,Dr. Janine Zahlten,178237475,10426,Charité - Universitätsmedizin Berlin
111267551,Dr. Sebastian Schuchmann,14884029,10426,Charité - Universitätsmedizin Berlin
233640436,Dr. Felicitas Escher,5437494,10426,Charité - Universitätsmedizin Berlin
233297459,Dr. Chotima Böttcher,324671656,10426,Charité - Universitätsmedizin Berlin
1671779,Professor Dr. Fabian Klostermann,272293,10426,Charité - Universitätsmedizin Berlin
257863,Dr. Michal Hua Fan,271543,10426,Charité - Universitätsmedizin Berlin
1524655,"Professor Dr. Andreas Patzak, Ph.D.",273389,10426,Charité - Universitätsmedizin Berlin
1098780,Professorin Dr. Regine Heilbronn,5271050,10426,Charité - Universitätsmedizin Berlin
827443,Professor Dr. Christian Strasburger,823482,10426,Charité - Universitätsmedizin Berlin
1101976,Professor Dr. Volker Hess,372766,10426,Charité - Universitätsmedizin Berlin
1385937,Professor Dr. Hanno Riess,5345513,10426,Charité - Universitätsmedizin Berlin
1767477,Professor Dr. Thomas Fischer,289347353,10426,Charité - Universitätsmedizin Berlin
192458465,Dr. Jochen Hecht,37822918,10426,Charité - Universitätsmedizin Berlin
214598287,Dr. Dido Lenze,63567637,10426,Charité - Universitätsmedizin Berlin
1214015,Professor Dr. Pontus Börje Persson,273389,10426,Charité - Universitätsmedizin Berlin
1388619,Professor Dr. Peter Wust,5092612,10426,Charité - Universitätsmedizin Berlin
1340036,Professor Dr. Andreas Ziegler,5164124,10426,Charité - Universitätsmedizin Berlin
1817271,Professor Dr. Lutz Schomburg,823482,10426,Charité - Universitätsmedizin Berlin
1642576,Professor Dr. Ulrich Kintscher,273389,10426,Charité - Universitätsmedizin Berlin
1853664,Dr. Tom Schilling,5355194,10426,Charité - Universitätsmedizin Berlin
49905937,Dr. Verena Moos,49905922,10426,Charité - Universitätsmedizin Berlin
234419161,Dr. Tobias Alexander,5449312,10426,Charité - Universitätsmedizin Berlin
193336373,Professorin Dr. Il-Kang Na,29918427,10426,Charité - Universitätsmedizin Berlin
1872077,Professor Dr. Winfried Brenner,236447042,10426,Charité - Universitätsmedizin Berlin
1758380,Dr. Christian Geier,138587823,10426,Charité - Universitätsmedizin Berlin
1379655,Professor Dr. Volker Budach,5345523,10426,Charité - Universitätsmedizin Berlin
1852099,Privatdozent Dr. Robert Preissner,5164174,10426,Charité - Universitätsmedizin Berlin
1088687,Professor Dr. Christian Hagemeier,5130694,10426,Charité - Universitätsmedizin Berlin
1853432,Dr. Sven Müller-Röver,5355124,10426,Charité - Universitätsmedizin Berlin
1738366,Professor Dr. Jörg Geiger,462239,10426,Charité - Universitätsmedizin Berlin
31600611,Professorin Dr. Martina Meinke,240243629,10426,Charité - Universitätsmedizin Berlin
243115836,Dr. Helena Radbruch,243108928,10426,Charité - Universitätsmedizin Berlin
1586677,"Professor Dr. Wolfgang Kübler, Ph.D.",273587,10426,Charité - Universitätsmedizin Berlin
1038624,Professor Dr. Rainer Duchmann,5411106,10426,Charité - Universitätsmedizin Berlin
1311996,Professor Dr. Hans-Dieter Volk,5130748,10426,Charité - Universitätsmedizin Berlin
234417172,Dr. Guido Heine,5449270,10426,Charité - Universitätsmedizin Berlin
257883,Dr. Katharina Detjen,271543,10426,Charité - Universitätsmedizin Berlin
16216148,Professor Dr. M. Schönfelder,273389,10426,Charité - Universitätsmedizin Berlin
1425638,Dr. Martin Heck,5225248,10426,Charité - Universitätsmedizin Berlin
1334845,Professorin Dr. Margitta Worm,5449270,10426,Charité - Universitätsmedizin Berlin
257877,Privatdozent Dr. Stefan Rosewitz,271543,10426,Charité - Universitätsmedizin Berlin
254336895,Dr. Till Althoff,259313274,10426,Charité - Universitätsmedizin Berlin
1418409,Professorin Dr. Petra Reinke,5130760,10426,Charité - Universitätsmedizin Berlin
29918913,"Professorin Dr. Chiara Romagnani, Ph.D.",29918792,10426,Charité - Universitätsmedizin Berlin
1236852,Professor Dr. Hans Rommelspacher,272341,10426,Charité - Universitätsmedizin Berlin
1433438,Professor Dr. Heiko Krude,823482,10426,Charité - Universitätsmedizin Berlin
194175204,Privatdozentin Dr. Anja A. Kühl,5411227,10426,Charité - Universitätsmedizin Berlin
139284331,Professor Dr. Nils Blüthgen,5377243,10426,Charité - Universitätsmedizin Berlin
1020401,Professor Dr. Gerd-Rüdiger Burmester,5130912,10426,Charité - Universitätsmedizin Berlin
1637059,Privatdozentin Dr. Hua Fan,5164118,10426,Charité - Universitätsmedizin Berlin
1399708,Professorin Dr. Gudrun Ahnert-Hilger,462239,10426,Charité - Universitätsmedizin Berlin
468312,Dr. Stefan Weger,82367575,10426,Charité - Universitätsmedizin Berlin
63485342,Dr. Soyoung Lee,63485089,10426,Charité - Universitätsmedizin Berlin
1451337,Professor Dr. Christian Rosenmund,462239,10426,Charité - Universitätsmedizin Berlin
1283142,Professor Dr. Rajan Somasundaram,5225440,10426,Charité - Universitätsmedizin Berlin
1443426,Professorin Dr. Ulrike Susanne Stein,5093052,10426,Charité - Universitätsmedizin Berlin
14844657,Dr. F. Gregory Wulczyn,462239,10426,Charité - Universitätsmedizin Berlin
1097232,Professor Dr. Rainer Hellweg,272341,10426,Charité - Universitätsmedizin Berlin
1523809,Privatdozent Dr. Alexander Oksche,271543,10426,Charité - Universitätsmedizin Berlin
228897628,Dr. Lena Ulm,228897633,10426,Charité - Universitätsmedizin Berlin
1101648,Dr. Peter Henklein,5130972,10426,Charité - Universitätsmedizin Berlin
1721100,Privatdozentin Dr. Isrid Sturm,5092816,10426,Charité - Universitätsmedizin Berlin
1851783,Dr. Jens Dernedde,63649081,10426,Charité - Universitätsmedizin Berlin
1749419,Professor Dr. Josef Priller,5139534,10426,Charité - Universitätsmedizin Berlin
1040207,Professor Dr. Kai-Uwe Eckardt,271543,10426,Charité - Universitätsmedizin Berlin
14865718,Dr. Georg C. Schwabe,14865678,10426,Charité - Universitätsmedizin Berlin
63711098,Dr. Christine Brandt,63711036,10426,Charité - Universitätsmedizin Berlin
49906095,Dr. Kathrin Rieger,49906044,10426,Charité - Universitätsmedizin Berlin
1229834,Professorin Dr. Vera Regitz-Zagrosek,273389,10426,Charité - Universitätsmedizin Berlin
1167562,"Professor Dr. Manfred Lindau, Ph.D.",5354133,10426,Charité - Universitätsmedizin Berlin
1776781,Professorin Dr. Angela Kaindl,141129565,10426,Charité - Universitätsmedizin Berlin
1591158,Professorin Dr. Beate Rau,5092816,10426,Charité - Universitätsmedizin Berlin
827374,Professorin Dr. Heike Biebermann,823482,10426,Charité - Universitätsmedizin Berlin
1416809,Professorin Dr. Verena Stangl,273587,10426,Charité - Universitätsmedizin Berlin
1539692,Professor Dr. Rudolf Tauber,5164168,10426,Charité - Universitätsmedizin Berlin
1775928,Professorin Dr. Jutta Weber,46753651,10278,Universität Paderborn
1376941,Professor Dr. Thomas Tröster,122265303,10278,Universität Paderborn
1045368,Professor Dr. Gregor Engels,201411427,10278,Universität Paderborn
1788105,Professor Dr. Artur Zrenner,5080066,10278,Universität Paderborn
5976,Professor Dr. Friedhelm Meyer auf der Heide,5112098,10278,Universität Paderborn
1541793,Professor Dr.-Ing. Ansgar Trächtler,5376705,10278,Universität Paderborn
1543950,Professor Dr.-Ing. Jadran Vrabec,5167220,10278,Universität Paderborn
1483352,Dr.-Ing. Norbert Fröhleke,5376713,10278,Universität Paderborn
45564456,Professor Dr.-Ing. Reinhard Keil,46753651,10278,Universität Paderborn
321191628,Professor Dr. Tim Bartley,321191962,10278,Universität Paderborn
1599085,Dr.-Ing. Tobias Hemsel,5376717,10278,Universität Paderborn
1167590,Professor Dr. Jörg K. N. Lindner,250513673,10278,Universität Paderborn
212936972,Professor Dr. Thomas Zentgraf,43884780,10278,Universität Paderborn
1875339,Dr.-Ing. Mario Porrmann,5376697,10278,Universität Paderborn
1786256,Professorin Dr. Annette Brauerhoch,46753651,10278,Universität Paderborn
134552967,Professor Dr. Eike Lau,16870850,10278,Universität Paderborn
1839575,Professor Dr. Michael Tiemann,222832873,10278,Universität Paderborn
1811894,Professor Dr. Cedrik Meier,5365331,10278,Universität Paderborn
1189817,Professor Dr. Burkhard Monien,5112098,10278,Universität Paderborn
31949187,Professor Dr. Wolfgang Bremser,50069566,10278,Universität Paderborn
1766214,Professor Dr. Detmar Zimmer,5376713,10278,Universität Paderborn
1822471,Professor Dr. Claus-Jochen Haake,201410672,10278,Universität Paderborn
